id,title,price,comment,shopName,url,img,img_list,attriName1,attriListName,attriListImg,attriName2,attriListSize,attriName3,attriListMode,shopRating
10115835569096,【白鹿推荐】磁悬浮,16.91,2000+,京喜自营官方店,https://item.jd.com/10115835569096.html,jfs/t1/173348/7/51945/91797/674ed649F456d9c64/119a1bd894aac959.jpg.avif,"jfs/t1/173348/7/51945/91797/674ed649F456d9c64/119a1bd894aac959.jpg.avif, jfs/t1/244542/39/20915/43479/6708fdcfF133844ea/bc6b6cc79c6b262c.jpg.avif, jfs/t1/107631/10/51135/114685/6708fdd0Fff5c6daf/9147bb341816647e.jpg.avif, jfs/t1/244486/16/20747/26315/6708fdd0F6b407101/41940201b2f74f6e.jpg.avif, jfs/t1/219534/8/44068/27013/6708fdd0F11c54644/3de9205b6f2b05d5.jpg.avif",选择款式                                                ,"标准版珍珠白【4支杜邦刷头】6档模式, 标准版少女粉【4支杜邦刷头】6档模式, 标准版典雅黑【4支杜邦刷头】6档模式, 升级款珍珠白【4刷头】6档模式, 升级款少女粉【4支杜邦刷头】6档模式, 升级款典雅黑【4支杜邦刷头】6档模式, 升级款情侣装【白+粉】各4支杜邦刷头+6档模式, 升级款情侣装【黑+粉】各4支杜邦刷头+6档模式, 升级款情侣装【黑+白】各支4杜邦刷头+6档模式","jfs/t1/173348/7/51945/91797/674ed649F456d9c64/119a1bd894aac959.jpg.avif, jfs/t1/224605/20/30242/93930/674ed64eF51bf36c9/4c311e4639572772.jpg.avif, jfs/t1/226640/16/28040/94782/674ed64aFc8e2bd6d/3a2b65016394d793.jpg.avif, jfs/t1/244253/40/25766/95350/674ed645F3f24f446/ce1040923e36dc89.jpg.avif, jfs/t1/231887/6/31418/97498/674ed644F869aac8e/b4fdca9cd2109b4c.jpg.avif, jfs/t1/217649/11/51299/98490/674ed647F3f421886/76df0ff1f0599e58.jpg.avif, jfs/t1/248459/1/27210/108003/674ed646F6bdc7647/437a179eff4d77ab.jpg.avif, jfs/t1/191308/37/52066/110545/674ed642F59b9a02f/620f61e424423e0e.jpg.avif, jfs/t1/223588/34/47014/108699/674ed640F0e006d29/77c5be85051e9f2e.jpg.avif",,,,,5.0
100004883003,华为智选力博得,149.00,100万+,华为京东自营官方旗舰店,https://item.jd.com/100004883003.html,jfs/t1/205367/28/44893/65039/674aa3a5F2fcdd09b/c203727b9fa9efb8.jpg.avif,"jfs/t1/205367/28/44893/65039/674aa3a5F2fcdd09b/c203727b9fa9efb8.jpg.avif, jfs/t1/96233/2/45876/73346/65e1b718F3e1481b2/20fe339e67122b17.jpg.avif, jfs/t1/177222/34/42284/47344/65e1b731F5879bb6d/55d652b985a44b17.jpg.avif, jfs/t1/176294/33/38365/39150/65e1b735F9be4b595/4fcc1410aac5a9d5.jpg.avif, jfs/t1/85631/29/44634/64271/65e1b73dF424010fb/7631d1f75257e607.jpg.avif",选择款式                                                ,"【爆款进阶】清洁不打牙丨星夜黑, 【爆款进阶】清洁不打牙丨月影白, 【爆款进阶】清洁不打牙| 冰晶蓝, 【热卖爆款】清洁不漏刷丨桃气粉, 【爆款限定】清洁不打牙| 藕荷粉, 【星空礼盒】2支装| 重磅上新, 【经典爆款】|智能洁齿|星夜黑, 【经典爆款】|智能洁齿|光感白, 【经典爆款】|智能洁齿|元气绿, 【甄选礼盒】|2支装|丰富配置","jfs/t1/148111/17/48415/76422/674ed472Fab8b6399/4d6410d74e60284b.jpg.avif, jfs/t1/249601/2/27428/70259/674ed46bF1c15db63/676edcb8e3704606.jpg.avif, jfs/t1/244745/1/26535/74406/674ed460F4f882096/99472bf64209437d.jpg.avif, jfs/t1/195358/35/54453/69750/674ed46dF115194ad/cad69be88225ec20.jpg.avif, jfs/t1/242059/18/25946/78240/674c63b6F19a53d9b/2d84d69515558903.jpg.avif, jfs/t1/183805/3/53626/102395/674aa3bfF83fcc639/ef9ca5d99d94bd8b.jpg.avif, jfs/t1/243225/31/25321/69971/674aa3b5F64f7d282/5750bc0352f7c19f.jpg.avif, jfs/t1/205367/28/44893/65039/674aa3a5F2fcdd09b/c203727b9fa9efb8.jpg.avif, jfs/t1/193965/22/52690/65789/674aa3adFf5767d37/08e77a76668b8690.jpg.avif, jfs/t1/222873/14/49304/83847/674aa3b9Fe102d11c/6eb3000a6e7d871a.jpg.avif",,,,,5.0
10026026457370,飞科,149.00,20万+,飞科官方旗舰店,https://item.jd.com/10026026457370.html,jfs/t1/174134/11/51959/50701/673c2b28Ffd5dcd49/aeea6d9e3f3dc8a1.png.avif,"jfs/t1/147853/16/40455/49260/667a643fF963764b8/89ba53979971a727.png.avif, jfs/t1/159574/27/43537/94349/65f8051fF9ef5dcf6/8bf133aa7158d743.jpg.avif, jfs/t1/242283/26/6243/37539/65f8051eF60648b0c/341caec2d5cfd5ac.jpg.avif, jfs/t1/177550/16/43562/46227/65f8051eF388266a9/3966be7166971c61.jpg.avif, jfs/t1/105543/24/40505/32434/65f8051dFd9172718/0d979dfbb3636d32.jpg.avif",选择款式                                                ,"深海蓝【共4支刷头】, 浪漫粉【共4支刷头】, [情侣2支装】深海蓝&浪漫粉, 深海蓝【圣诞限定礼袋】, 浪漫粉【圣诞限定礼袋】, 深海蓝【父亲节限定礼盒】","jfs/t1/147853/16/40455/49260/667a643fF963764b8/89ba53979971a727.png.avif, jfs/t1/246546/21/12102/48609/667a6453F55b0aa00/ef81a083c54dccf8.png.avif, jfs/t1/150834/14/44839/57885/66c55891Fcf3ec6cc/8732ec2c1aea73c5.png.avif, jfs/t1/172803/13/51741/75197/6746d8afF9e4e163f/b5a35d7c01781334.jpg.avif, jfs/t1/202701/19/51181/74595/6746d8bbF899aa778/ad7601d305749ade.jpg.avif, jfs/t1/242910/4/12977/51033/667a5bb0F112530e2/686ce0a2548f1d0f.png.avif",,,,,
100139988694,laifen徕芬新一代扫振,289.00,2万+,徕芬京东自营旗舰店,https://item.jd.com/100139988694.html,jfs/t1/185986/14/54080/80354/67499abdF11be7e9f/00ab9f6ca90ae5a9.jpg.avif,"jfs/t1/185986/14/54080/80354/67499abdF11be7e9f/00ab9f6ca90ae5a9.jpg.avif, jfs/t1/150436/25/47937/33374/6745794dF1cf1bb43/cfbdc78dff38cc54.jpg.avif, jfs/t1/6922/6/34204/24911/66f51d0aF2df896e0/af1c519736b88674.jpg.avif, jfs/t1/192890/11/48012/31725/66f51d09Ff7001797/27814377cc3379d4.jpg.avif, jfs/t1/185230/28/47220/53833/66f51d09Fdeeef4ec/d1373eda6ff7fc65.jpg.avif",选择款式                                                ,"【新品】SE 黄色, 【新品】SE 哑光白, 【新品】SE 哑光灰, 【新品】SE 粉色, 1代 粉色, 1代 光感白, 1代 奶茶色, 1代 紫色, 1代 蓝色","jfs/t1/247325/35/25943/69604/67499abfF40919cb2/0ba7e24c7f00d7f9.jpg.avif, jfs/t1/208482/17/50429/63432/67499ac0Fe9fee8db/aa3bbd381eb87c1f.jpg.avif, jfs/t1/239100/32/17749/65739/67499abeF1d8b3010/f20f2b1f0c5052fc.jpg.avif, jfs/t1/247796/16/26586/67489/67499abfF4820ead3/4065d466a7522ac8.jpg.avif, jfs/t1/209859/9/50926/80624/67499abdF8e96bc02/273aaad2d75bf644.jpg.avif, jfs/t1/210486/9/50891/76909/67499abeFa0b465ae/61165afe5e1677f8.jpg.avif, jfs/t1/185986/14/54080/80354/67499abdF11be7e9f/00ab9f6ca90ae5a9.jpg.avif, jfs/t1/196277/38/53564/80359/67499abcFf05cd3c2/0497b5ded6c132df.jpg.avif, jfs/t1/197718/4/49274/80533/67499abdFfc71130d/2cd6b434ca1cc298.jpg.avif",,,,,5.0
10103895518186,小米（MI） 米家声波,69.00,2万+,小米智能官方旗舰店,https://item.jd.com/10103895518186.html,jfs/t1/148323/30/40803/50026/66487d14Fc8eb6f33/ec0bc40964689e80.jpg.avif,"jfs/t1/148323/30/40803/50026/66487d14Fc8eb6f33/ec0bc40964689e80.jpg.avif, jfs/t1/247118/31/8897/29055/66462734F4742c012/efa2957891b851db.jpg.avif, jfs/t1/243561/7/8996/55081/66462733F0dc6fa63/b60419bfb6028057.jpg.avif, jfs/t1/230258/12/18062/72696/66462733Fde86783a/c87121a1ecece93e.jpg.avif, jfs/t1/229682/10/15386/50846/66462733Ff69c9c91/1b55fb166e43e662.jpg.avif",选择款式                                                ,"米家声波电动牙刷T200蓝色, 米家声波电动牙刷T200粉色, T200蓝色+原装牙刷头套装, T200粉色+原装牙刷头套装, T200蓝色+粉色情侣套装, T200/T200C原装替换刷头3支装","jfs/t1/165193/8/40995/143174/664d9a2aFdcd9a2b0/4a20d3211fbcf6a0.jpg.avif, jfs/t1/148323/30/40803/50026/66487d14Fc8eb6f33/ec0bc40964689e80.jpg.avif, jfs/t1/219639/16/40180/76891/66487d26F05547d1d/c81a3418ae701596.jpg.avif, jfs/t1/230067/19/16825/77045/66487d35Fa25bdf77/4fadaa594e7530e7.jpg.avif, jfs/t1/134874/14/45472/68768/66487d43F9f632356/d9252176902ef927.jpg.avif, jfs/t1/136047/6/41081/70965/66487d50Fe9bf7380/77b648b803de9ebc.jpg.avif",,,,,
10026612681290,拜尔（BAIR）G2/G201高端旗舰机,239.00,5万+,拜尔（BAIR）旗舰店,https://item.jd.com/10026612681290.html,jfs/t1/114643/10/38592/115646/648f208fF0156c452/5e874ec893e98d25.jpg.avif,"jfs/t1/114643/10/38592/115646/648f208fF0156c452/5e874ec893e98d25.jpg.avif, jfs/t1/67536/40/24624/105513/66a06386F0402abba/c80d8ec394aaf1cc.jpg.avif, jfs/t1/17353/13/21053/69852/668cae43F0896b829/1cfbda3b41254f30.jpg.avif, jfs/t1/164749/38/42719/134294/65efc818Fa99cd283/4fb7ee4c39f48105.jpg.avif, jfs/t1/115022/15/30887/90306/63a2cf11E3ab9e840/ae7451ebf3cb6f5b.jpg.avif",选择款式                                                ,"魅力黑（6枚原装刷头）, 薄雾灰（6枚原装刷头）, 真爱粉（6枚原装刷头）, 克莱因蓝（6枚原装刷头）","jfs/t1/114643/10/38592/115646/648f208fF0156c452/5e874ec893e98d25.jpg.avif, jfs/t1/175608/38/34942/101702/648f2098Fa8cc7bb2/ba3b5ad3a77559ee.jpg.avif, jfs/t1/201803/40/2040/135260/611d151eE450a28ca/fcb9a7c0a9c8e503.jpg.avif, jfs/t1/185477/16/33133/74015/6422fc3aFc0e83728/d5d9be2a88875edf.jpg.avif",,,,,
100034863324,舒客情侣,99.00,10万+,舒客个护健康京东自营旗舰店,https://item.jd.com/100034863324.html,jfs/t1/222209/24/49942/101447/6749566cFea3690f1/bba1d470d28bcf3b.jpg.avif,"jfs/t1/222209/24/49942/101447/6749566cFea3690f1/bba1d470d28bcf3b.jpg.avif, jfs/t1/193090/18/45298/45953/66879118F02110408/8a57db978d067ea2.jpg.avif, jfs/t1/222082/38/28421/140651/651511b4F4391fa03/9f58ebcd9a8c66fc.jpg.avif, jfs/t1/203/11/22890/89589/66879119Fa1d14e95/5c989e5b5990b2c8.jpg.avif, jfs/t1/245431/16/13681/57879/66879119F8dca2791/f8dc407e4dedae87.jpg.avif",选择款式                                                ,"【高效清洁 软毛护龈】T3-冰岛白, 【高效清洁 软毛护龈】T3-挪威蓝, 【高效清洁 软毛护龈】T3-极夜蓝, 【高性价比 入门推荐】T2-白色, 【高性价比 入门推荐】T2-粉色, 【高性价比 入门推荐】T2-黑色, 【5大模式 清洁美白】G33A-多肉, 【5大模式 清洁美白】G33A-蓝莓, 【高效清洁 软毛护龈】T3情侣装","jfs/t1/211560/29/50285/114192/67495a04F73600319/e7dee0870ffdd1be.jpg.avif, jfs/t1/149914/18/47699/119931/67495669F8d846d28/2e4aad391c4d21db.jpg.avif, jfs/t1/238683/6/19326/121860/6749566aF7936a64b/a23bf93d0e86410c.jpg.avif, jfs/t1/222209/24/49942/101447/6749566cFea3690f1/bba1d470d28bcf3b.jpg.avif, jfs/t1/227332/2/30524/100840/6749566cF00b8902b/e5f9fcc680c162ce.jpg.avif, jfs/t1/157839/36/49999/102957/673dbac0F9aa44e81/750c3872c38256a5.jpg.avif, jfs/t1/124045/20/52929/80871/6733fce7Ff0f246c8/12a9575f68594d9b.jpg.avif, jfs/t1/243637/13/22675/81730/6733fce5Ffb0b569d/c2d5d0c483fe9541.jpg.avif, jfs/t1/190089/27/50932/101666/6733fcd9F90bdb013/77e44db14d0a00e7.jpg.avif",,,,,5.0
100022050008,京东京造,89.00,10万+,京东京造自营官方旗舰店,https://item.jd.com/100022050008.html,jfs/t1/246857/30/24833/127540/67455e61Fc4a4043f/a25efa299040d384.jpg.avif,"jfs/t1/246857/30/24833/127540/67455e61Fc4a4043f/a25efa299040d384.jpg.avif, jfs/t1/184617/15/36601/68625/64ec45e4Fe8a9a4a4/620522eeac8d6116.jpg.avif, jfs/t1/126510/6/34479/76890/64ec45e4F6c47e828/5e52003c9a6af322.jpg.avif, jfs/t1/193463/2/36871/56143/64ec45e4Fd8299995/b219cad2d3512b2a.jpg.avif, jfs/t1/165104/2/37116/49911/64ec45e4Ffb1c042e/4f29ee81d0fab88a.jpg.avif",选择款式                                                ,"热销款JZ3-40000次/分震动/5模式, 礼品款JZ7-4支无铜刷头/20°摆幅","jfs/t1/246857/30/24833/127540/67455e61Fc4a4043f/a25efa299040d384.jpg.avif, jfs/t1/179526/24/53911/146264/674d1578F00348c60/b2be1a8f1732790c.jpg.avif",,,,,5.0
53800533010,小米（MI）米家声波扫振,119.00,2000+,小米智能官方旗舰店,https://item.jd.com/53800533010.html,jfs/t1/176405/23/50605/151695/674d5a81F78a3f64e/58b995ff4501867b.jpg.avif,"jfs/t1/176405/23/50605/151695/674d5a81F78a3f64e/58b995ff4501867b.jpg.avif, jfs/t1/217783/10/44750/68383/6712473bF30b59cf4/d47529931102c09f.jpg.avif, jfs/t1/241126/15/21015/19681/6712473bF58cc73fc/18a54deb5fd19e8a.jpg.avif, jfs/t1/232480/23/27292/41166/6712473aFa2d9d339/32fad18c156f3186.jpg.avif, jfs/t1/223054/16/43236/50345/6712473aF1eb2c866/e3b65e111a5a7092.jpg.avif",选择款式                                                ,"小米扫振电动牙刷 白色, 小米扫振电动牙刷 蓝色, 小米扫振电动牙刷 粉色, 小米扫振电动牙刷情侣套装（蓝色+粉色）, 小米扫振电动牙刷家庭套装（白色+蓝色+粉色）","jfs/t1/176405/23/50605/151695/674d5a81F78a3f64e/58b995ff4501867b.jpg.avif, jfs/t1/246278/5/26437/156685/674d5a82F4b51bd46/337cac6bfd2ba5d6.jpg.avif, jfs/t1/158052/6/49287/161452/674d5a84F9ce616f9/e63d9918d3619f5d.jpg.avif, jfs/t1/164215/18/52983/126214/674d5a89Fb6dac5b2/b92f25917988bf31.jpg.avif, jfs/t1/216840/9/49709/132636/674d5a8aF934b72b3/a6185d4d0b4e791d.jpg.avif",,,,,
100139988696,laifen徕芬新一代扫振,547.80,500+,徕芬京东自营旗舰店,https://item.jd.com/100139988696.html,jfs/t1/247922/9/25717/31033/674418ddF09389a98/1da3b6c997d49ebd.jpg.avif,"jfs/t1/247922/9/25717/31033/674418ddF09389a98/1da3b6c997d49ebd.jpg.avif, jfs/t1/5964/16/25794/37697/66cc438bF3fe0a274/285c5d09dc5cf470.jpg.avif, jfs/t1/67378/19/28392/64935/66cc438aFa113f008/eb28b2ff934ab5fd.jpg.avif, jfs/t1/19237/10/22394/44649/66cc438aF3257fba4/827e073c69bf4016.jpg.avif, jfs/t1/160378/10/47689/53420/66cc4389Fdd383d15/7f7bd051113be8a3.jpg.avif",选择款式                                                ,"紫色, 深灰色","jfs/t1/221918/24/48601/30695/674418ddFab53b465/c6db593aa94eb2bb.jpg.avif, jfs/t1/247922/9/25717/31033/674418ddF09389a98/1da3b6c997d49ebd.jpg.avif",,,,,5.0
100108145984,京东京造,99.00,2万+,京东京造自营官方旗舰店,https://item.jd.com/100108145984.html,jfs/t1/220072/35/48477/228315/674d1564F35cb9b21/453f9526e0445b60.jpg.avif,"jfs/t1/220072/35/48477/228315/674d1564F35cb9b21/453f9526e0445b60.jpg.avif, jfs/t1/248362/26/9603/156111/664b5033Ffe533a2c/fcf6c4e5cf9d6edd.jpg.avif, jfs/t1/151131/12/26557/121012/664b5032F8e643d0a/897c735937bd5101.jpg.avif, jfs/t1/195347/34/44591/73346/664b502eF81dcac7d/f5095a41d0299022.jpg.avif, jfs/t1/237644/5/16172/33079/664b502aF26789513/686051883c889cee.jpg.avif",选择款式                                                ,"礼盒款JZ5s白-4支无铜刷头/座充, 礼盒款JZ5s蓝-4支无铜刷头/座充, 扫振礼盒款【皓月白-配3款刷头】, 扫振礼盒款【丝缎银-配3款刷头】","jfs/t1/231385/16/31559/200985/674d1551Fa003f556/bf5ef62b65141d08.jpg.avif, jfs/t1/220072/35/48477/228315/674d1564F35cb9b21/453f9526e0445b60.jpg.avif, jfs/t1/248944/38/27588/86657/6750380bF451b0424/389bada0b7cee156.jpg.avif, jfs/t1/173638/30/52714/86477/675037f1F015a30bc/55cd698148d98002.jpg.avif",,,,,5.0
100084268546,usmile笑容加,189.00,20万+,usmile笑容加京东自营旗舰店,https://item.jd.com/100084268546.html,jfs/t1/182198/8/53897/93341/674fb627F7638ef65/03ddcc924f3bb64f.jpg.avif,"jfs/t1/182198/8/53897/93341/674fb627F7638ef65/03ddcc924f3bb64f.jpg.avif, jfs/t1/227652/1/8666/47478/657bf5ccF220da003/456a9fb24ad26de8.jpg.avif, jfs/t1/234704/35/7896/35530/657bf5cbF20b1b504/a680fca759e25c4e.jpg.avif, jfs/t1/238131/23/7945/81937/657bf5caF9b4cfe5f/18a04f20d470657e.jpg.avif, jfs/t1/89263/11/37653/75930/662a110eF26d32a54/d6668b98d04b7286.jpg.avif",选择款式                                                ,"P10昆仑白, P10柔光灰, P10派对粉","jfs/t1/197270/25/52159/95437/674fb488F9e2d689a/0acf95b6001c9635.jpg.avif, jfs/t1/193163/27/51195/90237/674fb5c9F6bd2d285/bca8478083f7e193.jpg.avif, jfs/t1/182198/8/53897/93341/674fb627F7638ef65/03ddcc924f3bb64f.jpg.avif",,,,,5.0
10103392318862,小米（MI） 米家声波,72.15,20万+,小米智能官方旗舰店,https://item.jd.com/10103392318862.html,jfs/t1/223862/36/51595/72661/67501237Ffdc29521/3c85cd77737f6e9c.jpg.avif,"jfs/t1/223862/36/51595/72661/67501237Ffdc29521/3c85cd77737f6e9c.jpg.avif, jfs/t1/133348/35/43526/54348/663f38daF23ae643c/e7f9f6f434c30c32.jpg.avif, jfs/t1/184226/1/44636/37453/663f38daFe04d3774/827474874e49ba12.jpg.avif, jfs/t1/247458/26/8741/27108/663f38d9F1efb1bd4/1565a298e155263f.jpg.avif, jfs/t1/191661/14/45162/29417/663f38d9F88f44851/1919710f342ad0d7.jpg.avif",选择款式                                                ,"米家T100电动牙刷头（通用型)三支装, 米家声波电动牙刷T100—白色, 米家声波电动牙刷T100—蓝色, 米家声波电动牙刷T100—粉色, 米家声波电动牙刷T100白色+原装刷头套装, 米家声波电动牙刷T100蓝色+原装刷头套装, 米家声波电动牙刷T100粉色+原装刷头套装, 米家电动牙刷T100蓝色+粉色情侣装, 米家T100电动牙刷头（通用型) 6支装","jfs/t1/163036/40/49491/90179/6750120eF2cb6d04f/0e8775cb2c420de5.jpg.avif, jfs/t1/168424/36/24810/70726/67501212F3c0b83de/805477e0811886d1.jpg.avif, jfs/t1/240988/29/18068/70593/67501215Fdca3f92b/7c0c3c0e23db9f96.jpg.avif, jfs/t1/204022/14/49505/71042/6750121aF68a46812/0661df7286f7318d.jpg.avif, jfs/t1/186346/32/54669/76623/67501222Fc63c7270/a6405c3b0ff748a2.jpg.avif, jfs/t1/210316/7/48544/76516/67501226F883bd70a/a89e66417c3c4d4b.jpg.avif, jfs/t1/225566/27/13020/76973/67501231F78c7054f/da4fc429a6d71d66.jpg.avif, jfs/t1/223862/36/51595/72661/67501237Ffdc29521/3c85cd77737f6e9c.jpg.avif, jfs/t1/217506/1/50698/79001/67501242F16385f4c/35c5ef822e158c7e.jpg.avif",,,,,
10057650515081,小米（MI） 米家声波,37.90,5000+,京东电竞电器旗舰店,https://item.jd.com/10057650515081.html,jfs/t1/66870/23/17184/90222/62ea3bddE0b8e0d15/98e925442f6f06c7.jpg.avif,"jfs/t1/66870/23/17184/90222/62ea3bddE0b8e0d15/98e925442f6f06c7.jpg.avif, jfs/t1/31319/2/16728/63398/62e906e0E9f896227/f5802212890109ea.jpg.avif, jfs/t1/194164/31/27504/72952/62e906e4E88a23b68/d7a4710da3c4d3a2.jpg.avif, jfs/t1/191125/32/26796/29417/62e906e4E4003cf3c/0783ab7116641ecc.jpg.avif, jfs/t1/197405/21/25699/45705/62e906e3E261d0f07/3aedd1191505244e.jpg.avif",选择款式                                                ,"米家电动牙刷头(通用型)三支装T100, 米家声波电动牙刷T100-蓝色, 米家声波电动牙刷T100-粉色, 米家声波电动牙刷T100-白色","jfs/t1/80187/8/21268/118586/62ea3bb9Eab685a03/00b3e507e06c50b7.jpg.avif, jfs/t1/69021/34/20940/72629/62ea3bd0E5e07241d/992f766344fca50d.jpg.avif, jfs/t1/66870/23/17184/90222/62ea3bddE0b8e0d15/98e925442f6f06c7.jpg.avif, jfs/t1/147091/16/27889/82679/62ea3bb9E0ce01848/80483354bd8fd007.jpg.avif",,,,,
114942,欧乐B,109.00,100万+,欧乐B口腔护理京东自营旗舰店,https://item.jd.com/114942.html,jfs/t1/148560/5/49598/121067/67492a01Fa9540561/8977c54e2d065f76.jpg.avif,"jfs/t1/148560/5/49598/121067/67492a01Fa9540561/8977c54e2d065f76.jpg.avif, jfs/t1/14724/2/8278/257414/5c74de87E30326fe4/94ad01d35b0c5387.jpg.avif, jfs/t1/194719/18/2772/347272/609cc6e2E0ef29758/3b84b5e8ca643324.jpg.avif, jfs/t1/231797/2/29700/127776/6734ace9Ff1970fd2/4d41ef4955b833cb.jpg.avif, jfs/t1/166474/21/3244/84157/60069058Eeed94e44/f604349e4868a021.jpg.avif",选择款式                                                ,"【新升级护龈】iO2柔波刷 白色, 【新升级护龈】iO2柔波刷 黑色, 【入门爆款】D12 蓝色, 【入门爆款】D12 橙色, 【到手2支】单支仅用89, 【到手2支】单支仅需89","jfs/t1/150507/37/49169/91195/675005c8F1af3cd71/4c5c15e7bb809d9a.jpg.avif, jfs/t1/199874/3/52963/95059/67500645F119f33f9/bb987d02a3a8ab5b.jpg.avif, jfs/t1/148560/5/49598/121067/67492a01Fa9540561/8977c54e2d065f76.jpg.avif, jfs/t1/150227/32/44915/128632/674929f1Fb97b6e58/20d5719a84036f60.jpg.avif, jfs/t1/182783/24/54753/145902/675005deFea922691/c0759b86c2f56c1f.jpg.avif, jfs/t1/90492/18/53363/147102/675005bfF60f98c75/a51d43b5c5666a59.jpg.avif",,,,,5.0
100105744179,博朗（BRAUN）【国家补贴】朱一龙同款,1499.00,5万+,博朗个人护理京东自营旗舰店,https://item.jd.com/100105744179.html,jfs/t1/178667/24/54902/128031/67502e44F795a3631/b87bb4d8c3f12070.jpg.avif,"jfs/t1/178667/24/54902/128031/67502e44F795a3631/b87bb4d8c3f12070.jpg.avif, jfs/t1/247682/35/14929/131865/6690e7b7F681af4fa/4ebd4aab7e3d0cb4.jpg.avif, jfs/t1/3210/37/22117/121659/66acb76aFabd0fdb0/e5ad30f39c2f2306.jpg.avif, jfs/t1/239829/22/11748/77389/66793143Fcd7ff5e7/f97be4df8de14179.jpg.avif, jfs/t1/229046/21/18150/112550/66793142Ffd970169/b96234d79f902c1d.jpg.avif",选择款式                                                ,"【国家补贴】爆款套组9667cc, 9667cc生日限定, 【国家补贴】顶配单刀9617s, 9617s 经典黑色, 适用9系/9系Pro刀头, 【国家补贴】入门单刀9017s, 【国家补贴】入门套组 9063cc, 【国家补贴】至尊套组 9675cc, 剃须刀清洁液补充装8盒装, 剃须刀清洁液补充装4盒装","jfs/t1/198200/36/52436/126467/67502732F6f2f5204/633a4b4cc3f7ea89.jpg.avif, jfs/t1/199528/11/48064/104467/6750275bFfc86181b/63d7d6dd19a63210.jpg.avif, jfs/t1/243107/14/27411/132635/675027afFad4f37c7/a1e811d025eb03cc.jpg.avif, jfs/t1/220075/36/51023/116060/675027cbF5980550d/1534b66c6a6b1530.jpg.avif, jfs/t1/207710/26/44061/97222/6709e108F989bcc8b/eb921e9a246762c1.jpg.avif, jfs/t1/178667/24/54902/128031/67502e44F795a3631/b87bb4d8c3f12070.jpg.avif, jfs/t1/234874/21/31455/134552/67502e6dF3f458822/116e46d1077b1a26.jpg.avif, jfs/t1/242227/13/26394/124313/675020ccF2ad42f8e/8641225ccc6f4a4a.jpg.avif, jfs/t1/66922/30/27214/97909/66e29859Fca4aec79/99edf1121239a541.jpg.avif, jfs/t1/102206/16/49666/77492/66c2fed6F5aa13321/6eecef4f56069d9c.jpg.avif",,,,,5.0
100021824357,飞利浦（PHILIPS）电动,198.99,500万+,飞利浦京东自营官方旗舰店,https://item.jd.com/100021824357.html,jfs/t1/225309/33/31222/124530/674985ceF6576d22e/c47758873a518358.jpg.avif,"jfs/t1/225309/33/31222/124530/674985ceF6576d22e/c47758873a518358.jpg.avif, jfs/t1/160057/7/29006/93291/649cf82fF55cf9dc0/13d795266cdcc137.jpg.avif, jfs/t1/150344/3/27174/147899/649cf82fF9c8006c8/e95a536c029ab2fd.jpg.avif, jfs/t1/229982/19/21190/46031/66879f1cFc65d01e7/d01584e898d7f20b.jpg.avif, jfs/t1/129206/14/33293/78875/649cf82fFc16ac172/d5439dd3bf8f4e67.jpg.avif",选择款式                                                ,"进口自研磨刀头, 经典便携款, 新1系时尚外观, 新1系时尚外观 礼盒款, 新1系理容套装, 经典2系风驰切剃, 新2系超净切剃, 新2系理容套装, 新2系强劲净剃, 新3系快充版, 3系高配版, 3系高配版礼盒装, 3系高配理容套装, 新3系配鬓角修剪, 全新3系恒稳智控","jfs/t1/205457/14/51146/120482/67498534F68a8c0f0/232ad813f92902dd.jpg.avif, jfs/t1/176516/27/53970/118329/6749855eF590b1ba9/1948428a3d8f1041.jpg.avif, jfs/t1/206100/33/50981/154040/6749857fFcc5518c9/e2625360b48fe1b7.jpg.avif, jfs/t1/224809/29/25806/170879/67498599F3a4b1597/8a4a5d3ec5095dd9.jpg.avif, jfs/t1/148067/31/47432/85454/67319e8aFe6199e3f/25db29a3aa1c7972.jpg.avif, jfs/t1/248805/6/26358/124241/674985b3F9ba1b2ff/56295d5b5d1b3fa4.jpg.avif, jfs/t1/225309/33/31222/124530/674985ceF6576d22e/c47758873a518358.jpg.avif, jfs/t1/191165/36/51356/92937/67319e90F7448ad06/5ba88e8554e1c2d5.jpg.avif, jfs/t1/208549/17/49556/98339/674985f7F547467ba/7c8a15e15f930ae2.jpg.avif, jfs/t1/223022/5/49202/110021/674d2b45Fe2afb7c4/4f13724b32f42d57.jpg.avif, jfs/t1/186055/5/53583/138657/674d2b2cFf323e96f/5d4086f644ffdf24.jpg.avif, jfs/t1/221367/26/50717/143039/674d2b5fFa44a1a3c/7c96d6200c362e96.jpg.avif, jfs/t1/199135/32/48097/85123/67319e8fF9b4bd415/0fcafdb9db5f9365.jpg.avif, jfs/t1/199767/16/50741/109804/67498735Fbdeb9a88/ed42b52d7579e94e.jpg.avif, jfs/t1/234063/13/28390/145149/67498753F84c7fe8c/1132871e1b85d470.jpg.avif",,,,,5.0
100040933075,米家电动,89.00,50万+,小米京东自营旗舰店,https://item.jd.com/100040933075.html,jfs/t1/247032/3/27560/94902/674fd97bF10b73bb1/2b020267395bfedf.jpg.avif,"jfs/t1/247032/3/27560/94902/674fd97bF10b73bb1/2b020267395bfedf.jpg.avif, jfs/t1/67245/6/18060/19923/64043c0eFf6d70d6e/2b893cf612b6fdca.jpg.avif, jfs/t1/217371/35/21436/67921/632c5684E90f86fbd/9c3035a8dd654df8.jpg.avif, jfs/t1/131447/37/26294/90126/632c5687E1638165b/e026f02b6c04b746.jpg.avif, jfs/t1/122022/16/24544/88982/632c5689E0bb0863b/ff9f95aad36cada3.jpg.avif",选择款式                                                ,"热销爆款S101岩砂灰 | 双环18刀, 热销爆款S101暮光蓝 | 双环18刀","jfs/t1/197436/18/52051/97242/674fd962Fc41cc2a6/95f664c5eb00991b.jpg.avif, jfs/t1/247032/3/27560/94902/674fd97bF10b73bb1/2b020267395bfedf.jpg.avif",,,,,5.0
10098857083496,OES【明星推荐】,26.90,2万+,OES官方旗舰店,https://item.jd.com/10098857083496.html,jfs/t1/5440/4/26456/112074/670d0e0bFbd300e17/fe30234058419769.png.avif,"jfs/t1/5440/4/26456/112074/670d0e0bFbd300e17/fe30234058419769.png.avif, jfs/t1/200001/17/41404/68650/65fb9c3eF25f6a33e/2e43ca6069718d73.jpg.avif, jfs/t1/230211/20/15845/92911/65fd392bFe63dede2/ea58189aa05701bf.jpg.avif, jfs/t1/173488/18/43175/89101/65fd3937F2f01ed46/a23cfe568bb38a7b.jpg.avif, jfs/t1/247103/36/6214/56574/65fb9c3dFaf5c10a7/75af5de616a53c8f.jpg.avif",选择款式                                                ,"【基础六叶款】3000W转+一键启动, 【加强六叶款】6000W转+干湿双剃+升级动力, 【胶囊悬浮款】9000W转+升级悬浮刀头+赠鼻毛刀","jfs/t1/5440/4/26456/112074/670d0e0bFbd300e17/fe30234058419769.png.avif, jfs/t1/242185/18/21129/115330/672ac656Fab98d28b/bffa822266fefa74.jpg.avif, jfs/t1/130970/14/48122/106660/67234775Fd725cf1e/e9020e4bd53a9588.jpg.avif",,,,,4.7
