id,title,price,comment,shopName,url,img,img_list,attriName1,attriListName,attriListImg,attriName2,attriListSize,attriName3,attriListMode,shopRating,extraPrice
10069595730366,洁丽雅【无甲醛致癌物认证】防臭,,10万+,洁丽雅家居鞋旗舰店,https://item.jd.com/10069595730366.html,jfs/t1/135710/4/32017/69958/6445e9dfF180c8567/5067c6c1fea875bd.jpg.avif,"jfs/t1/135710/4/32017/69958/6445e9dfF180c8567/5067c6c1fea875bd.jpg.avif, jfs/t1/99411/24/24145/170113/643f97cdF673b76b7/ab9499b4a6b636b4.jpg.avif, jfs/t1/54894/18/21536/45699/643f966bFc1796899/7fc59345ce658699.jpg.avif, jfs/t1/59519/9/26412/57530/64460c34F396e83f8/1c699998521c9fca.jpg.avif, jfs/t1/65446/29/19366/55523/63f9a22cF64d812ee/f0126a8c9b3fe125.jpg.avif",选择颜色                                                ,"浅灰, 黑色, 藏青, 绿色, 黄色, 粉色, 浅灰色【柔软舒适】, 黑色【柔软舒适】, 咖色【柔软舒适】, 浅灰【升级款】, 黑色【升级款】, 藏青【升级款】, 绿色【升级款】, 黄色【升级款】, 【粉色】升级款","jfs/t1/135710/4/32017/69958/6445e9dfF180c8567/5067c6c1fea875bd.jpg.avif, jfs/t1/202191/30/33991/59132/643f9955Fa8bfd5e7/2af7e80cb518fc4d.jpg.avif, jfs/t1/139323/36/35001/66514/643f995bF49ef9435/76fe0af5e94487b0.jpg.avif, jfs/t1/114937/14/36876/80342/64780bfbFb4cafb96/a1f1171441ba1ed6.jpg.avif, jfs/t1/141025/3/36251/70723/643f998aF4ee3cd95/426bfa0e53e1a5de.jpg.avif, jfs/t1/96441/39/34040/67683/643f9993Ff009d1e2/6e146ab2348de20c.jpg.avif, jfs/t1/92483/7/47594/38038/65e3df3dF14f4cfa4/4e75f5731cbf4bc3.png.avif, jfs/t1/159146/35/43666/37454/65e3df52F07b2556e/a2df21b9e493f3d6.png.avif, jfs/t1/209490/7/40195/75260/65eff5c5F2fc20eaa/db8f4fb88a7e6436.png.avif, jfs/t1/157337/18/48393/99638/67009dc6Fc7d238da/3f7cf2fe625e1089.jpg.avif, jfs/t1/180645/21/48118/84821/67009dd2Feeb5df63/484af42a886ce456.jpg.avif, jfs/t1/244499/6/20451/97321/67009dd2F5df0a8ec/e2354706e60e1d06.jpg.avif, jfs/t1/179795/21/48566/111529/67009dd1F79203086/5fcc7a5e4baf1b51.jpg.avif, jfs/t1/235674/22/26591/101279/67009dd3Fdb6eb633/3e9eefa9157e300c.jpg.avif, jfs/t1/131701/28/46815/99530/67009dd3Fafeb7d59/e71547669516221d.jpg.avif",选择尺码                                                ,"40-41 （适合39-40码）, 42-43 （适合41-42码）, 44-45 （适合43-44码）, 36-37 （适合35-36码）, 38-39 （适合37-38码）",,,4.9,9.90
7315378,乐拖,,50万+,乐拖（LETUO）京东自营旗舰店,https://item.jd.com/7315378.html,jfs/t1/91638/14/49446/70169/66ec2074Ff5bd9e60/b37a05ccf481c438.jpg.avif,"jfs/t1/91638/14/49446/70169/66ec2074Ff5bd9e60/b37a05ccf481c438.jpg.avif, jfs/t1/218752/40/30610/173842/646de953F26be412a/14d41e06954c2f59.jpg.avif, jfs/t1/137586/26/36686/97229/646de954Fd6866a0d/67d3745f8f3b9b58.jpg.avif, jfs/t1/51952/34/23790/67437/646de955Fbfaa9bd9/7fef47c2c4a0ce03.jpg.avif, jfs/t1/218787/1/28384/79642/646de954Fbdeb3901/c2fe247df3de26fd.jpg.avif",选择颜色                                                ,"微笑猫深灰, 微笑猫浅灰, 微笑猫深蓝, 微笑猫粉色, 微笑猫紫色","jfs/t1/107026/7/47996/94358/66ec206eFaa78bf59/5e9adac5042c43f3.jpg.avif, jfs/t1/91638/14/49446/70169/66ec2074Ff5bd9e60/b37a05ccf481c438.jpg.avif, jfs/t1/105715/15/45906/121434/66ec2071F4e0b769b/f08abeda8bf2b6d3.jpg.avif, jfs/t1/231735/7/27470/110787/66ec206cF8d565cd8/c2320d99bcd1dcfc.jpg.avif, jfs/t1/249599/32/19234/94055/66ec2069F98c99850/be0e3f542f31845e.jpg.avif",选择尺码                        ,"36-37（适合35-36）, 38-39（适合37-38）, 40-41（适合39-40）, 42-43（适合41-42）, 44-45（适合43-44）",,,5.0,19.90
10084785892020,猫力踩屎感棉,,2万+,猫力家居旗舰店,https://item.jd.com/10084785892020.html,jfs/t1/155553/27/47860/238209/66f5fe48F7c333686/4142c1559d9373d6.jpg.avif,"jfs/t1/155553/27/47860/238209/66f5fe48F7c333686/4142c1559d9373d6.jpg.avif, jfs/t1/110778/8/43513/222115/66c04beeF66b355dc/9722c43a94b3f753.jpg.avif, jfs/t1/97593/36/44965/77223/6502d35eFbeb0570f/936c490a36dad041.jpg.avif, jfs/t1/106159/2/45056/83778/6502d35eF6c8d2ad1/fa8921d69390f7b8.jpg.avif, jfs/t1/179479/36/37642/92480/6502c587Fb1307391/590561edc57abaac.jpg.avif",选择颜色                                                ,"灰色熊, 灰色【大眼】, 白色熊, 粉色熊, 粉色【大眼】, 绿色【大眼】, 绿色熊, 白色[BEAR], 黄色[BEAR], 粉色[BEAR], 紫色[BEAR], 棕色[BEAR], 浅灰[BEAR], 深灰[BEAR]","jfs/t1/155553/27/47860/238209/66f5fe48F7c333686/4142c1559d9373d6.jpg.avif, jfs/t1/96466/40/42535/199012/65236904Fe78b1f99/34a10fb200c2b750.jpg.avif, jfs/t1/247729/39/17132/180890/66c04c72Fa42b3d75/fff8f02124d15c3b.jpg.avif, jfs/t1/89139/33/42745/282745/66c04c61Fe0e845cd/66db4af7025453f3.jpg.avif, jfs/t1/151897/39/36908/215601/65236870Fbeb55bd9/d6b9c3d2384a2ebc.jpg.avif, jfs/t1/150650/3/36442/194282/65236883Fc81e9c98/b659a39d6c212942.jpg.avif, jfs/t1/84939/22/42270/195754/652367dbF0a9768f0/0ed624d530ae1f20.jpg.avif, jfs/t1/148613/18/47426/101341/670dcf0dF1bd6ac52/5df13a0c94701549.jpg.avif, jfs/t1/159067/26/45581/115834/670dcf0cFc88ca387/d54a4baadf158c74.jpg.avif, jfs/t1/196970/32/45929/110942/670dcf0cFb0e0c0e2/88d76f28c6891e8c.jpg.avif, jfs/t1/106629/1/53307/136366/670dcf0dF58de69d8/9b79c49a54373fb1.jpg.avif, jfs/t1/190342/6/49556/231985/670dc441Fd08c0e1f/76416898d26eb41e.jpg.avif, jfs/t1/156204/36/48146/163276/670dc440F11c9cd35/fb74339b850004c6.jpg.avif, jfs/t1/179246/5/49971/180781/670dc43cFe7b1006e/da0135c73703b993.jpg.avif",选择尺码                                                ,"36-37 (220mm) 适合35-36, 38-39 (230mm) 适合37-38, 40-41 (240mm) 适合39-40, 42-43 (250mm) 适合41-42, 44-45 (260mm) 适合43-44",,,,10.80
100023708795,JOYTOUR旅行便携,,20万+,佳途（JOYTOUR）京东自营旗舰店,https://item.jd.com/100023708795.html,jfs/t1/182243/28/32232/40437/64f6c81cF5a0cf473/58e02162f0a4165b.jpg.avif,"jfs/t1/182243/28/32232/40437/64f6c81cF5a0cf473/58e02162f0a4165b.jpg.avif, jfs/t1/196052/34/37194/91342/64f6c641F4822c48a/ee2a67910320aa20.jpg.avif, jfs/t1/188342/28/38113/76945/64f6c641F00dbe4d6/64466b25139dbdc7.jpg.avif, jfs/t1/144014/8/39855/55968/64f6c641Fcf036045/2a530cec5ff2b4a9.jpg.avif, jfs/t1/180242/34/37152/89266/64f6c641F2ef75095/0618e06fe02be29e.jpg.avif",选择颜色                                                ,"黄色36-37码, 黄色38-39码, 黄色40-41码, 灰色40-41码, 灰色42-43码, 灰色44-45码, 儿童拖鞋黄色24-29, 儿童拖鞋黄色30-35","jfs/t1/128370/28/40124/39592/64f6c655F6358963a/f6f4b0dfa6a5c977.jpg.avif, jfs/t1/128370/28/40124/39592/64f6c655F6358963a/f6f4b0dfa6a5c977.jpg.avif, jfs/t1/128370/28/40124/39592/64f6c655F6358963a/f6f4b0dfa6a5c977.jpg.avif, jfs/t1/182243/28/32232/40437/64f6c81cF5a0cf473/58e02162f0a4165b.jpg.avif, jfs/t1/182243/28/32232/40437/64f6c81cF5a0cf473/58e02162f0a4165b.jpg.avif, jfs/t1/182243/28/32232/40437/64f6c81cF5a0cf473/58e02162f0a4165b.jpg.avif, jfs/t1/56465/22/24741/44293/63a15b79E65a3d10c/8acdd85720194e2f.jpg.avif, jfs/t1/217696/20/23959/44374/63a15d79Eb73cc8e9/9662f6923411d8d3.jpg.avif",,,,,5.0,9.90
100103443786,AOKANG,,2万+,奥康（Aokang）拖鞋京东自营旗舰店,https://item.jd.com/100103443786.html,jfs/t1/224199/5/20801/117255/667161d3F784ef565/4c53c5147fdef6f3.jpg.avif,"jfs/t1/224199/5/20801/117255/667161d3F784ef565/4c53c5147fdef6f3.jpg.avif, jfs/t1/102741/21/40610/51208/65fa6722F3f41fdb2/0ac404a71a606780.jpg.avif, jfs/t1/148653/6/38700/105128/65fa671eF9f08c8ec/daf5b9f8bcf8e384.jpg.avif, jfs/t1/102786/3/41110/70052/65fa670dFce49915d/a9525263e8eb0a75.jpg.avif, jfs/t1/243453/29/5758/52550/65fa6718Fd84bb559/99d263bdcb340fce.jpg.avif",选择颜色                                                ,"灰色, 黑色","jfs/t1/224199/5/20801/117255/667161d3F784ef565/4c53c5147fdef6f3.jpg.avif, jfs/t1/229824/23/19096/119357/667161c5Fa89cc0c3/b645295f4080251d.jpg.avif",选择尺码                                                ,"40-41【适合39-40】, 42-43【适合41-42】, 44-45【适合43-44】",,,5.0,19.90
10113014411047,COOLCHAP【张佳宁同款】加绒勃肯鞋女进口牛反绒防泼羊绒手工厚底包头,,200+,COOLCHAP官方旗舰店,https://item.jd.com/10113014411047.html,jfs/t1/107393/17/56871/114884/67468256Fb184c73b/5c2578470111e3bd.jpg.avif,"jfs/t1/107393/17/56871/114884/67468256Fb184c73b/5c2578470111e3bd.jpg.avif, jfs/t1/8220/9/27344/250299/66d6b5c0Fba5dcd59/a508ce107a26a02b.jpg.avif, jfs/t1/80879/26/28826/159856/66ce842aF303c1014/2fbe27387bf6732b.jpg.avif, jfs/t1/104294/30/51178/67102/66d15d84F50f4f84f/b0234c7c147b5d99.jpg.avif, jfs/t1/78486/6/27785/130897/66cd6570F7e48b74c/cfdb9dbf4743d4df.jpg.avif",选择颜色                                                ,"月色沙丘（加绒）-全包 沙色, 粉色沙海（加绒）-全包 棕粉色, 月色沙丘（加绒）沙色, 粉色沙海（加绒）棕粉色, 月色沙丘 沙色, 粉色沙海 棕粉色, 赤霞橘光 卡其橙, 月色沙丘-全包 沙色 建议选小一码, 棕粉色-全包 棕粉色 建议选小一码","jfs/t1/192787/35/53382/121184/67468260F3fba412e/b794adbd3b486924.jpg.avif, jfs/t1/191292/27/53326/118677/67468261F3a53d69e/3966471ecd27c01f.jpg.avif, jfs/t1/199246/25/51280/128260/674ff421Fdeeaf884/8830d4214b73ebed.jpg.avif, jfs/t1/176883/8/53711/134298/674ff422F566b26e6/3300243b04234149.jpg.avif, jfs/t1/107393/17/56871/114884/67468256Fb184c73b/5c2578470111e3bd.jpg.avif, jfs/t1/181471/17/52501/134060/67468257F897ffa23/2a0d6ae9ebb1901f.jpg.avif, jfs/t1/218918/21/49650/127229/67468258Fc6684912/4a04ff67f086d249.jpg.avif, jfs/t1/193447/7/54513/125672/6746825aFac3ef1df/65d44ff6257eddef.jpg.avif, jfs/t1/249673/10/25995/127226/6746825cF88c76c08/7654e48fce38e017.jpg.avif",选择尺码                                                ,"35, 36, 37, 38, 39, 40, 41, 42, 43, 44",,,4.7,359.00
10113199545926,踩屎感,,5000+,京喜自营官方店,https://item.jd.com/10113199545926.html,jfs/t1/217920/21/51617/52709/674ec715Fd027d12e/f12036a0a6bb1f33.jpg.avif,jfs/t1/244406/33/27353/52721/67519e57F5f10e0f9/f489b748c5eb3dda.jpg.avif,选择颜色                                                ,"红色, 粉色, 绿色, 象牙色, 黑色, 灰色, 咖色","jfs/t1/174838/22/51384/64787/67519e50Facb58436/f6d539799ec6a89f.jpg.avif, jfs/t1/242083/32/26394/56860/67519e52F9a9884cd/9618649eb3686afe.jpg.avif, jfs/t1/183479/19/54243/58392/67519e53Fd53fe91e/164a3563e4ade9a3.jpg.avif, jfs/t1/171746/10/53041/58200/67519e54F0675a0a9/094ef134ddc216ed.jpg.avif, jfs/t1/189460/3/54679/37670/67519e57F2ae7bbc3/ef55187bb46b722b.jpg.avif, jfs/t1/244406/33/27353/52721/67519e57F5f10e0f9/f489b748c5eb3dda.jpg.avif, jfs/t1/240029/20/25727/51752/67519e5bFb319e531/660c54806739ec7d.jpg.avif",选择尺码                                                ,"36-37, 38-39, 40-41, 42-43, 44-45",,,5.0,21.26
10086448980354,回力秋冬季居家棉,,2万+,回力强仁专卖店,https://item.jd.com/10086448980354.html,jfs/t1/244145/13/19998/201979/6705d79dFbfdbee5f/3d15ff06dbe0e130.jpg.avif,"jfs/t1/186115/3/48570/217900/6705d7b9Fa2793412/4182de494f2b03d8.jpg.avif, jfs/t1/193539/38/40171/165828/65362474Fc74c1126/059ce1278fd36008.jpg.avif, jfs/t1/189338/17/38570/81993/6536243fF712dae3a/e70cc6b7cec49bdc.jpg.avif, jfs/t1/210677/25/36485/119641/6536243fF77a4488d/9759d429b0819a8c.jpg.avif, jfs/t1/236637/17/463/151354/6536243eF48b261b4/31c30f0b9cecb4ab.jpg.avif",选择颜色                                                ,"灰色, 棕色, 粉色, 橘色, 绿色, 蓝灰【0564】 EVA鞋底, 深灰【0564】 EVA鞋底, 粉色【0564】 EVA鞋底, 米白【0564】 EVA鞋底, 紫色【0564】 EVA鞋底","//img14.360buyimg.com/n9/s60x80_jfs/t1/186115/3/48570/217900/6705d7b9Fa2793412/4182de494f2b03d8.jpg.avif, //img14.360buyimg.com/n9/s60x80_jfs/t1/106751/38/34890/161446/6536247cF15ec516f/329b0ceb59d95da4.jpg.avif, //img14.360buyimg.com/n9/s60x80_jfs/t1/107050/31/26192/169888/65362475Fc69a5c71/dade6e277b4c6cac.jpg.avif, //img14.360buyimg.com/n9/s60x80_jfs/t1/194100/33/38941/184877/65362475Fbbf1a7e3/594aaaa316c61ca6.jpg.avif, //img14.360buyimg.com/n9/s60x80_jfs/t1/101070/39/41307/149041/65362476F77942203/80720ca5a996c86f.jpg.avif, //img13.360buyimg.com/n9/s60x80_jfs/t1/99650/39/44253/172812/65b8b1bbF1d2052cb/3295f0070644e5bd.jpg.avif, //img13.360buyimg.com/n9/s60x80_jfs/t1/208428/25/38860/173497/65b8b1bbF4949de20/89c39f6119b32e4a.jpg.avif, //img13.360buyimg.com/n9/s60x80_jfs/t1/171800/5/41430/160929/65b8b1bcF8b39e83f/5d8d6f5198d01b65.jpg.avif, //img13.360buyimg.com/n9/s60x80_jfs/t1/237828/1/13158/153796/65b8b1bcF5330eda7/1707c67382c01b74.jpg.avif, //img13.360buyimg.com/n9/s60x80_jfs/t1/217548/21/36892/163015/65b8b1bdF7d58fcb5/58a98d14efd7a011.jpg.avif",选择尺码                                                ,"36-37 【偏小一码】, 38-39 【偏小一码】, 40-41 【偏小一码】, 42-43 【偏小一码】, 44-45 【偏小一码】",,,,26.90
10084058333783,洁丽雅棉,,2万+,洁丽雅家居鞋旗舰店,https://item.jd.com/10084058333783.html,jfs/t1/243612/19/17309/356474/674191edFc9af9d40/439881e3fd105793.jpg.avif,jfs/t1/247802/17/27941/140920/67529efeFa77e4226/2476bbb34b4d34f8.jpg.avif,选择颜色                                                ,"灰色, 咖色, 深灰【加绒保暖】, 灰色【厚底保暖】, 白色, 灰色 【防滑】, 咖色 【保暖】, 粉色, 粉色 【保暖】, 黄色 【保暖】","jfs/t1/247802/17/27941/140920/67529efeFa77e4226/2476bbb34b4d34f8.jpg.avif, jfs/t1/186244/6/52153/164319/6752b7dcF5cd75263/f793513e7203104e.jpg.avif, jfs/t1/243612/19/17309/356474/674191edFc9af9d40/439881e3fd105793.jpg.avif, jfs/t1/243724/36/25358/241506/6752b698F1945109c/dc4ab3be837c05e4.jpg.avif, jfs/t1/216168/40/50985/417333/674e4c31F8801685a/d528a74c6e638093.jpg.avif, jfs/t1/148487/6/45992/165059/6752b73cF50816629/fe124ae5e09dab36.jpg.avif, jfs/t1/239836/1/16654/2604384/6743efefF1c625ab9/0a264fa25d079a7e.png.avif, jfs/t1/241505/32/24023/190525/6743ee7aF8ab2df00/4c0e47b05f069ca8.jpg.avif, jfs/t1/196034/3/53379/103875/6743f07cFb7d1bb5d/a01e99b99594c35b.jpg.avif, jfs/t1/201607/26/49456/187920/6743f0b1F50a0b7c1/d551b1c19464dc7b.jpg.avif",选择尺码                                                ,"40-41 (270mm) (适合39-40码), 42-43 (280mm) (适合41-42码), 44-45 (290mm) (适合43-44码), 36-37 (250mm) (适合35-36码), 38-39 (260mm) (适合37-38码)",,,4.9,9.90
10095393471817,百慕倾臣买一送一情侣,,5000+,百慕倾臣官方旗舰店,https://item.jd.com/10095393471817.html,jfs/t1/229238/35/12034/173738/659f5a69F0d1973df/7215268ce48c7646.jpg.avif,"jfs/t1/229238/35/12034/173738/659f5a69F0d1973df/7215268ce48c7646.jpg.avif, jfs/t1/225742/3/9811/143142/659f5a69Fe371a503/d4b7a8f9d8b37790.jpg.avif, jfs/t1/105216/39/45775/118503/659f5a6cFb2105d7e/67fa91ef9e54987c.jpg.avif, jfs/t1/234634/10/12048/114924/659f5a75F2565e370/f1743ba0b345f061.jpg.avif, jfs/t1/241744/27/3037/57640/659f5a69F47b84028/7b002830bf1c67e2.jpg.avif",选择颜色                                                ,"米白+黑色, 米白+咖色, 米白+灰色, 米白+蓝色, 米白+绿色, 紫色+灰色, 紫色+黑色, 紫色+咖色, 绿色+黑色, 绿色+咖色, 绿色+灰色, 绿色+蓝色, 蓝色+黑色, 蓝色+咖色, 蓝色+灰色, 黑色+咖色, 黑色+灰色","jfs/t1/229238/35/12034/173738/659f5a69F0d1973df/7215268ce48c7646.jpg.avif, jfs/t1/231386/30/25392/204781/66babef2F4f83b3b2/1d9cf5a5d36ccb0a.jpg.avif, jfs/t1/233193/24/22040/95206/66babf25F2506cf04/706a42f3c9ddf670.jpg.avif, jfs/t1/242569/33/15504/95877/66babef0Fa83dc5ed/16f0591f0990d26a.jpg.avif, jfs/t1/150640/20/28060/204087/66babef1F3070bf75/b50a0e23e9d31861.jpg.avif, jfs/t1/227627/37/25066/106494/66babee8Fec9e6b4d/a5f6c4ca6a2ff4db.jpg.avif, jfs/t1/36301/10/22046/99489/66babeeaF0b5827a7/fa42d83566dcee08.jpg.avif, jfs/t1/3358/23/23350/228553/66babee9F6dd2e3b1/a81d23831a586737.jpg.avif, jfs/t1/107916/1/47328/214199/66babeedFeb494dca/7d8221c777f60a98.jpg.avif, jfs/t1/245621/1/14047/111469/66babeecFb221cffb/320bb59734420ff0.jpg.avif, jfs/t1/237932/10/22880/225969/66babeebF2174cea0/f6144b6f02880a71.jpg.avif, jfs/t1/225389/8/7188/109858/66babeeaFc8c0369e/5f79a208d264cd34.jpg.avif, jfs/t1/67240/5/27875/100858/66bac032F16d35c09/1bda5ef9055509e1.jpg.avif, jfs/t1/95088/25/45359/110285/66bac033F72e297ce/77cb4b5393208f40.jpg.avif, jfs/t1/245473/4/16644/107979/66bac04fF9c0efada/fe564d039728c8ea.jpg.avif, jfs/t1/62300/31/26613/209630/66babeefFb3678779/d9e7cd9c6848128c.jpg.avif, jfs/t1/224983/23/23875/202654/66babeeeF946399c4/ef101e309c910fa4.jpg.avif",选择尺码                                                ,"36-37 +40-41, 36-37 +42-43, 36-37 +44-45, 38-39 +40-41, 38-39 +42-43, 38-39 +44-45, 40-41 【两双装】, 40-41 +42-43, 40-41 +44-45, 36-37 【两双装】, 36-37 +38-39, 38-39 【两双装】, 42-43 【两双装】, 42-43 +44-45, 44-45 【两双装】",,,4.9,25.13
100099520265,京东京造【软欧包】花瓣,,1万+,京东京造自营官方旗舰店,https://item.jd.com/100099520265.html,jfs/t1/175698/27/47822/54785/66fa22afF1406f83f/7bfeee1a34b252a1.jpg.avif,"jfs/t1/175698/27/47822/54785/66fa22afF1406f83f/7bfeee1a34b252a1.jpg.avif, jfs/t1/226487/37/21303/58820/668652b5Fc00776f3/4fff2092ad89a983.jpg.avif, jfs/t1/236850/17/18104/94775/66615980F593e3f38/f158bfa6e3318fe8.jpg.avif, jfs/t1/210483/3/25597/63740/66615980F82807c30/c55d02b2a90ee7f6.jpg.avif, jfs/t1/121971/35/42161/77945/666158f9F4602abbe/a0cacb6538bff79e.jpg.avif",选择颜色                                                ,"樱花粉, 珍珠白, 嫩黄色, 浅绿色","jfs/t1/175698/27/47822/54785/66fa22afF1406f83f/7bfeee1a34b252a1.jpg.avif, jfs/t1/180102/28/49461/45816/66fa22b0F8d5c9325/9db909b4add3bea0.jpg.avif, jfs/t1/192269/14/48533/59416/66fa22aeF6fb62892/df750650947915c5.jpg.avif, jfs/t1/229229/8/26520/57101/66fa22afF913342f4/34d01609b1c4acc5.jpg.avif",选择尺码                                                ,"36-37（适合35-36）, 38-39（适合37-38）, 40-41（适合39-40）",,,5.0,19.90
100118253361,蕉内热皮701+男女同款保暖,,1000+,Bananain蕉内京东自营官方旗舰店,https://item.jd.com/100118253361.html,jfs/t1/249568/39/27029/44288/674d6f56F0161cc0d/aaae24ce37693673.jpg.avif,"jfs/t1/205611/36/50609/45230/6752d83bF338dff52/336a1f28b17d628f.jpg.avif, jfs/t1/105709/24/47094/70328/66d800adFb3c0b31d/14fd5d0ea236404c.jpg.avif, jfs/t1/229011/25/26221/66678/66d800acF04ccfd76/3d104e63fcba1dd7.jpg.avif, jfs/t1/87375/19/50370/37215/66d800abF0b7d6116/4fec3245d25aeab3.jpg.avif, jfs/t1/179916/3/47124/100503/66d800aaF6c6d9009/d6fe59d265818958.jpg.avif",选择颜色                                                ,"探险棕-包跟, 黑色-包跟, 苍岩灰-包跟, 桦木-包跟, 桦木绿-包跟, 海军蓝-包跟, 桦木-不包跟, 桦木绿-不包跟, 海军蓝-不包跟","jfs/t1/205611/36/50609/45230/6752d83bF338dff52/336a1f28b17d628f.jpg.avif, jfs/t1/205836/6/50146/33462/6752d83dFc98939c5/0b3ed932fd926615.jpg.avif, jfs/t1/244785/40/27972/36900/6752d83fF6b945db3/7ee9ffcc4d21b6d9.jpg.avif, jfs/t1/245762/5/27567/38851/6752d841Fda3e27a8/d1e75029e03cb20c.jpg.avif, jfs/t1/241774/9/27577/45466/6752d83eFd043fbdf/75543a88c4e75e2c.jpg.avif, jfs/t1/210229/6/50578/35155/6752d844Fb2e17fed/fd68dd4857e461eb.jpg.avif, jfs/t1/192919/16/52027/28863/6752d844F6c985ec8/8ac76e363e864ecf.jpg.avif, jfs/t1/247356/39/28226/38575/6752d845F3e979004/4a246572067be1f7.jpg.avif, jfs/t1/149057/35/44723/27373/6752d847Fc28a70f2/2427e024006c0dbb.jpg.avif",选择尺码                                                ,"35-36, 37-38, 39-40, 41-42, 43-44",,,5.0,179.10
100107479305,洁丽雅（Grace）居家情侣加厚,,5万+,洁丽雅京东自营官方旗舰店,https://item.jd.com/100107479305.html,jfs/t1/8345/1/27260/77534/672597a4Feb990f8f/ee34ca5bbf84bbdb.jpg.avif,"jfs/t1/8345/1/27260/77534/672597a4Feb990f8f/ee34ca5bbf84bbdb.jpg.avif, jfs/t1/184428/25/50991/56348/672597a3F7d2a11f5/e7d5198bce1c29ed.jpg.avif, jfs/t1/235950/14/17808/66675/66792129F4066f1e8/44bd787eb63d9bdd.jpg.avif, jfs/t1/233677/17/19080/58319/66792129F583eb509/320b4fdfd79872b0.jpg.avif, jfs/t1/244145/13/12527/48879/66792128F5c0265ed/3d15ff06dbe0e130.jpg.avif",选择颜色                                                ,"浅粉, 浅绿, 灰蓝, 卡其","jfs/t1/184428/25/50991/56348/672597a3F7d2a11f5/e7d5198bce1c29ed.jpg.avif, jfs/t1/191462/33/50344/56604/672597a4F2451d139/a0d18282d2ea5b96.jpg.avif, jfs/t1/8345/1/27260/77534/672597a4Feb990f8f/ee34ca5bbf84bbdb.jpg.avif, jfs/t1/156938/14/49429/55833/672597a2F2f3afde6/0b0b6c912944c0da.jpg.avif",选择尺码                                                ,"36/37, 38/39, 40/41, 42/43, 44/45",,,5.0,16.90
10088643732155,洁丽雅防水棉,,2万+,洁丽雅家居鞋旗舰店,https://item.jd.com/10088643732155.html,jfs/t1/183343/7/38748/47487/654dec84Fca8e8dd6/fb8c06cc41d07857.jpg.avif,"jfs/t1/183343/7/38748/47487/654dec84Fca8e8dd6/fb8c06cc41d07857.jpg.avif, jfs/t1/227102/27/2435/46558/654c66d4Fb18cd28d/5103510a742f6e74.jpg.avif, jfs/t1/229600/38/2364/53446/654c66d3F429c7f34/834af16c0dc96ba5.jpg.avif, jfs/t1/120350/16/40267/56815/654c66d5F501bb223/083a3e6085294e56.jpg.avif, jfs/t1/227947/37/2592/97757/654c66d4F12dc4688/8f46e574d972bf49.jpg.avif",选择颜色                                                ,"灰色【防水羽绒布，耐赃易清洗】, 深海蓝【防水羽绒布】, 奶咖【防水羽绒布】, 杏仁粉【防水羽绒布】, 奶白色【防水羽绒布】, 灰色【升级款】, 深蓝色【升级款】, 奶咖【升级款】, 杏仁粉【升级款】, 白色【升级款】, 灰色【防滑升级】, 卡其【防滑升级】, 粉色【防滑升级】, 紫色【防滑升级】","jfs/t1/183343/7/38748/47487/654dec84Fca8e8dd6/fb8c06cc41d07857.jpg.avif, jfs/t1/196778/16/43003/53156/654dec98Fe2cf9cbf/4aae4780470b409e.jpg.avif, jfs/t1/246824/32/21579/96321/6715e160Ff2aa5ba3/88686f5a92f01a6f.jpg.avif, jfs/t1/60053/28/26030/64688/654deca7F5e36cd50/ae52a9f53cb12868.jpg.avif, jfs/t1/186176/40/42714/57020/654decb2F0dc22b89/a4f5ffe116fde96d.jpg.avif, jfs/t1/122241/30/49133/93202/6715e20aF69aed60f/b2287e3e249d2883.jpg.avif, jfs/t1/167779/31/49517/94453/6715e211Fa2a2fd11/aa7dbd18831054e2.jpg.avif, jfs/t1/226178/17/27640/88750/6715e4d0F5920e19e/274f913878fbd96d.jpg.avif, jfs/t1/217703/5/44722/95719/6715e221F69f56369/cccff750d0443c08.jpg.avif, jfs/t1/124238/25/49489/90499/6715e229F087d2768/247f4d183b046816.jpg.avif, jfs/t1/167887/13/42122/252598/6719b22cF6713dd81/b7e72f03891a92c6.jpg.avif, jfs/t1/194329/29/49936/414805/6719b21cF67098f82/f4f65f06fa7549ee.jpg.avif, jfs/t1/133510/5/46911/176700/6719b208F4a9a76fe/0655ba9004587ab1.jpg.avif, jfs/t1/87190/30/53547/168657/6719b211F5a10689f/14f7ffc63a03b65a.jpg.avif",选择尺码                                                ,"40 -41(适合39-40), 42 -43(适合41-42), 44 -45（适合43-44), 38 -39(适合37-38), 36 -37(适合35-36)",,,4.9,16.90
10057265002061,KENROLL科柔专利防滑,,2万+,KENROLL科柔旗舰店,https://item.jd.com/10057265002061.html,jfs/t1/247453/22/23614/36831/6737101cF8e4bfd3e/13ee736bd8bd27cd.jpg.avif,"jfs/t1/247453/22/23614/36831/6737101cF8e4bfd3e/13ee736bd8bd27cd.jpg.avif, jfs/t1/216802/9/47710/45503/67370f50F24a3933b/7cd6c6c6f15d3f1e.jpg.avif, jfs/t1/179759/40/51982/54616/67370f50Fca6bf657/3fc3725f5706f9bc.jpg.avif, jfs/t1/159221/8/37220/46049/67370f4fF18fd63a4/712826b32b163301.jpg.avif, jfs/t1/245874/22/22859/30163/67370f4fFa3fa4d3e/94990ecd2fff55b2.jpg.avif",选择颜色                                                ,"淡红色, 灰豆绿, 卡其色, 鸽子灰, 暖粉色, 葡萄紫, 深蓝色, 浅灰色, 贝壳粉, 薄荷曼波, 墨玉绿, 铅灰色","jfs/t1/238350/24/26549/72595/67370f74F40c04a63/f76cbd06658a27db.jpg.avif, jfs/t1/101223/4/55015/37524/67370fe4F2b04c2a0/cd84312fd289bf44.jpg.avif, jfs/t1/219631/30/47798/36888/67370ff1F17dde4cc/16991c1e2434841c.jpg.avif, jfs/t1/247453/22/23614/36831/6737101cF8e4bfd3e/13ee736bd8bd27cd.jpg.avif, jfs/t1/153623/27/34742/33569/67371058F3c110bec/9efd7415226b2fbb.jpg.avif, jfs/t1/192951/28/51640/33907/67371059Fb94dedbb/023e46c8a25998f6.jpg.avif, jfs/t1/249659/34/24301/35396/67371057F543535d1/9122c6c3b7ce13ba.jpg.avif, jfs/t1/193861/29/51753/31501/67371058F86383555/c721625231e5082f.jpg.avif, jfs/t1/187926/21/52016/32603/673710f4Fc6194886/28d2d5e4c27bf3fd.jpg.avif, jfs/t1/223669/40/43766/34538/673710faF5ee127df/01cf6b772023e17f.jpg.avif, jfs/t1/189128/29/52004/35430/67371100Fe9a1dd7e/45292e59cdefba5f.jpg.avif, jfs/t1/190385/7/52337/29475/67371105Fb2c7873b/23578f0b153e36e9.jpg.avif",选择尺码                                                ,"35-36, 37-38, 39-40, 40-41, 42-43, 44-45",,,,59.90
100024447071,IQGD,,10万+,IQGD京东自营旗舰店,https://item.jd.com/100024447071.html,jfs/t1/202817/33/31753/52313/65b05817F5f26363e/f01aa13faaece42e.jpg.avif,"jfs/t1/202817/33/31753/52313/65b05817F5f26363e/f01aa13faaece42e.jpg.avif, jfs/t1/205736/18/31910/61364/65b05837Ff0a36ca2/ba941de4c63624b6.jpg.avif, jfs/t1/200629/31/27737/70401/65b05836F32f08772/afe0eed75bd553c0.jpg.avif, jfs/t1/245989/23/3983/92822/65b05835F811e1bb0/4bc7045fa977a436.jpg.avif, jfs/t1/218357/6/36299/36356/65b05835F5240b926/25b121f97169d1a5.jpg.avif",选择颜色                                                ,"冰淇淋-奶白, 冰淇淋-粉色, 冰淇淋-明紫, 冰淇淋-奶黄","jfs/t1/226172/29/13190/54429/65b05818Fd74fbb9f/d313cf6108781f1a.jpg.avif, jfs/t1/67129/32/25249/55896/65b05808Fcf85157e/93424d98657f0a7f.jpg.avif, jfs/t1/247395/17/3815/84731/65b05836F8354611e/aec7b0150a387b99.jpg.avif, jfs/t1/202817/33/31753/52313/65b05817F5f26363e/f01aa13faaece42e.jpg.avif",选择尺码                                                ,"36-37【适合35-36】, 38-39【适合37-38】, 40-41【适合39-40】",,,5.0,29.90
