id,title,price,comment,shopName,url,img,img_list,attriName1,attriListName,attriListImg,attriName2,attriListSize,attriName3,attriListMode,shopRating,extraPrice
100102180345,曼图瓦 意式,,5000+,曼图瓦 MANTOVA京东自营旗舰店,https://item.jd.com/100102180345.html,jfs/t1/237757/23/19487/40011/66826152F4723773e/7dd8d6e48b80bd1c.jpg.avif,"jfs/t1/237757/23/19487/40011/66826152F4723773e/7dd8d6e48b80bd1c.jpg.avif, jfs/t1/207581/32/34915/68730/665453c5F0bf69590/726ef042395f4f08.png.avif, jfs/t1/94321/16/44836/120456/665453c4F154ec291/178a61830a94cbd8.png.avif, jfs/t1/207076/4/42384/46202/665453c1Ffbf3b74a/73f5967987098586.png.avif",选择口味规格                                                ,"法式香浓·意式拼配 100g, 法式香浓·意式拼配 454g, 法式特醇·意式拼配 454g, 坚果焦糖.意式拼配 454g, 曼特宁·意式拼配 454g, 野樱莓·意式拼配 454g","jfs/t1/237757/23/19487/40011/66826152F4723773e/7dd8d6e48b80bd1c.jpg.avif, jfs/t1/225107/9/23685/71938/6698b5cbF415a791e/5105f413425f299a.jpg.avif, jfs/t1/159842/26/46425/56636/66545a8eFb301794f/42cc6d68580385e5.jpg.avif, jfs/t1/183926/14/44579/66098/66545736F81eb864d/da0e042878059756.jpg.avif, jfs/t1/182294/28/46167/65182/665459a3F3ef9a129/a1c00aec51205192.jpg.avif, jfs/t1/227379/10/19267/63166/6654583eF68d8a2d6/a19a8c5b1acc85bd.jpg.avif",,,,,5.0,9.90
10102987749116,嘉云（Cavendish&Harvey）德国进口水果糖散装结婚喜糖批发水果味什锦圣诞节,,1000+,昕梦食品专营店,https://item.jd.com/10102987749116.html,jfs/t1/90554/26/48539/250695/66c3f2aaF2d307f8a/37220758af2db269.jpg.avif,"jfs/t1/90554/26/48539/250695/66c3f2aaF2d307f8a/37220758af2db269.jpg.avif, jfs/t1/228988/2/22950/240933/66878ac1F9b5495b2/1e4ba8335430fc0b.jpg.avif, jfs/t1/210343/13/41461/209006/6639e311Fe38fa66f/a39c12b442abf01e.jpg.avif, jfs/t1/163929/6/45753/154211/6639e310F649fec64/1e347757ffdf5c29.jpg.avif, jfs/t1/195837/16/44799/306917/6639e30fF2222b135/cf8f2a878e0b9af3.jpg.avif",选择规格                                                ,"混合口味250g（约100颗）, 混合口味500g（约200颗）, 黑莓味250g（约100颗）, 柠檬味250g（约100颗）, 香橙味250g（约100颗）, 香梨味250g（约100颗）, 樱桃味250g（约100颗）, 薄荷味250g（约100颗）, 草莓夹心味硬糖175g盒装, 香橙味硬糖200g盒装, 混合水果味硬糖200g盒装, 热带杂果味硬糖200g盒装, 蜜桃树莓味夹心硬糖175g盒装, 酸柠檬味硬糖200g盒装, 苹果味夹心黑加仑味硬糖175g盒装, 柠檬柑橘味硬糖200g盒装, 什锦浆果味硬糖175g盒装, 芒果猕猴桃味硬糖200g盒装, 四季水果味硬糖200g盒装, 红心柚味200g盒装","jfs/t1/90554/26/48539/250695/66c3f2aaF2d307f8a/37220758af2db269.jpg.avif, jfs/t1/232605/25/21158/236692/667fbd5fF24cb4bd6/02823bfb4d691f6c.jpg.avif, jfs/t1/96795/14/49168/334265/66c3f2c0F45ccaec2/88f92520393e0b05.jpg.avif, jfs/t1/246513/36/17351/392382/66c3f2d8F8dd5ccc1/4781844fbf275d39.jpg.avif, jfs/t1/133472/21/45092/366825/66c3f347F0b326d0c/e5d083c7b63b161a.jpg.avif, jfs/t1/233029/39/24403/314031/66c3f32bFa080c5c8/8481cdea10fe669c.jpg.avif, jfs/t1/97351/37/47161/371024/66c3f302F27e995eb/ba02010f09e103ef.jpg.avif, jfs/t1/11727/35/22133/364987/66bc55d2F6073a6ee/2505e7ae1ccd3ad8.jpg.avif, jfs/t1/195355/4/48154/131399/66f2556cF5b810a8a/8a99bc92cce9ea5f.jpg.avif, jfs/t1/109196/25/53995/104050/66f255c4F96b05e22/71aa5244683f9ed1.jpg.avif, jfs/t1/226197/25/26434/152848/67077c09Fd063cb98/5cce9f92ee2ad58c.jpg.avif, jfs/t1/183164/19/49039/167725/67077c2eF06f45681/8b4f251667f5a068.jpg.avif, jfs/t1/228297/9/26136/108627/67077c3dF68d721a1/ff6e515ed9dfcd8c.jpg.avif, jfs/t1/217061/28/44221/165860/67077c55F7c529fd1/14e01ad0e3892d86.jpg.avif, jfs/t1/168476/22/51217/83484/67077c9eFb86b0530/7f175cc864ff3e78.jpg.avif, jfs/t1/206235/35/45947/116539/67077cb0Fbdcc9226/dbf85cb9a5a97792.jpg.avif, jfs/t1/168229/13/48973/125785/67077cc1Fe4ba7c49/7ed87b47a0267f17.jpg.avif, jfs/t1/192802/19/48851/130308/67077cceF942e9e3c/4275961810ee2a26.jpg.avif, jfs/t1/232997/3/25283/101175/67077ba8F8248e10d/ea22f6cc4b673bae.jpg.avif, jfs/t1/149888/28/44645/119346/67077b98F29f1d235/ceb949d147d555c5.jpg.avif",,,,,4.9,28.90
100068113413,阿尔卑斯 混合口味棒棒糖38支 休闲儿童水果硬,,10万+,阿尔卑斯曼妥思京东自营旗舰店,https://item.jd.com/100068113413.html,jfs/t1/232427/4/28536/152385/674b048bF662a59d2/8e740a0871f515d0.jpg.avif,"jfs/t1/232427/4/28536/152385/674b048bF662a59d2/8e740a0871f515d0.jpg.avif, jfs/t1/37615/36/24443/206553/66ed1b26Fc3c462ec/0cd39ef2bf6cee27.jpg.avif, jfs/t1/189183/14/48023/166838/66ed1b25Fd4a2fef4/2400c9925e6e9864.jpg.avif, jfs/t1/240382/9/18760/151616/66ed1b25Faa6fdb80/c1f6c311a31a6957.jpg.avif, jfs/t1/161027/22/48471/146593/66ed1b24F719d0537/b9b03b6790cdcb53.png.avif",选择规格                                                ,"混合口味棒糖38支, 混合棒棒糖25支, 草莓牛奶棒糖20支, 高级牛奶棒糖20支, 奶香好棒棒糖40支, 混合口味棒糖96支","jfs/t1/232427/4/28536/152385/674b048bF662a59d2/8e740a0871f515d0.jpg.avif, jfs/t1/221199/23/51103/156316/674b1768F14d04695/2f988bb125014101.jpg.avif, jfs/t1/245878/7/26851/149418/674b048cFa32dd0dc/10a3b9c939e4ec1a.jpg.avif, jfs/t1/218972/4/50368/130010/674b048bF2195d591/d60164508a41248c.jpg.avif, jfs/t1/240333/25/24394/175049/674b1771Fc5549a4b/5ca03917875838e8.jpg.avif, jfs/t1/205457/14/51360/152743/674b0486F15d9f757/232ad813f92902dd.jpg.avif",,,,,5.0,15.00
100067833676,宏源爆浆陈皮糖软糖喜糖剥皮糖软糖橡皮糖批发圣诞节,,10万+,宏源糖果京东自营旗舰店,https://item.jd.com/100067833676.html,jfs/t1/179478/33/49505/252109/670895c3Ff1336fe6/564b43cd13b88e57.jpg.avif,"jfs/t1/179478/33/49505/252109/670895c3Ff1336fe6/564b43cd13b88e57.jpg.avif, jfs/t1/235129/22/14427/265346/65e99740F46a50c7a/bd6153ca9f1d927b.jpg.avif, jfs/t1/90283/15/36673/185777/65e99741F3a94d509/9eb56a284abdf011.jpg.avif, jfs/t1/233071/21/13751/98053/65e9973fF315db762/1c5777f8f7a9179c.jpg.avif, jfs/t1/135878/11/48718/175674/6718bdfeFdb3502d6/332a2cf2b521e801.jpg.avif",选择规格                                                ,"陈皮糖500g1袋, 话梅糖500g1袋, 白桃糖500g1袋, 爆浆陈皮软糖500g1袋, 仔仔棒320g1袋, 陈皮糖2.5kg1袋, 爆浆话梅软糖500g1袋, 什锦糖888g1袋, 陈皮话梅糖1kg, 陈皮糖果500g","jfs/t1/196373/9/48664/157429/67023bdeF7b816cd3/32b1ab94a4832f78.jpg.avif, jfs/t1/194964/18/48828/208180/670658f7F930cdf20/34ec2a04d8d3c7e3.jpg.avif, jfs/t1/132038/39/47331/198131/67087ca4Fb44655d0/969db9d638f39858.jpg.avif, jfs/t1/179478/33/49505/252109/670895c3Ff1336fe6/564b43cd13b88e57.jpg.avif, jfs/t1/95482/13/53090/230054/67049910F81c84aaa/66fdceb918d7d1a1.jpg.avif, jfs/t1/165316/3/49912/212512/6708a1e7F2d6ef37b/5de8f12d9ef27bb2.jpg.avif, jfs/t1/239786/38/20550/209703/67087b55F662eb04b/36f4ac66a0b1f530.jpg.avif, jfs/t1/244958/16/18725/170205/66f5355cF36eb5779/efa0d8441e744d8f.jpg.avif, jfs/t1/233031/17/23005/256435/66fa6e9dF5be8f78d/dcd67597821f75f7.png.avif, jfs/t1/114984/23/52028/116026/673db6d1Ffc77cfd1/619a8e75d8e584bf.png.avif",,,,,5.0,17.90
64613760782,其妙水果味千纸鹤,,5万+,香客食品专营店,https://item.jd.com/64613760782.html,jfs/t1/131510/25/22275/235263/6215908fE12c301a1/8389cd2d2af2c709.jpg.avif,"jfs/t1/131510/25/22275/235263/6215908fE12c301a1/8389cd2d2af2c709.jpg.avif, jfs/t1/109871/5/2205/144765/5e044a6aEf84eecb8/55264140d836b59c.jpg.avif, jfs/t1/91295/35/8361/215707/5e044a6bE0badd02e/4dd9e70039100e6d.jpg.avif, jfs/t1/119079/28/24895/114517/626a2ebaEffeaba40/8201c52be0530af9.jpg.avif, jfs/t1/86984/38/8328/218841/5e044a6bEe1d011da/00f270b2e265580b.jpg.avif",选择规格                                                ,"千纸鹤水果糖 500g, 水果切片糖 500g【约175颗】, 【共1000g】水果切片糖+千纸鹤糖, 【共1000g】切片糖+椰子糖, 【共1000g】切片糖+麦片巧克力","jfs/t1/131510/25/22275/235263/6215908fE12c301a1/8389cd2d2af2c709.jpg.avif, jfs/t1/175450/13/27608/326006/6215909fEb2377cc2/84a042d4f71db987.jpg.avif, jfs/t1/178245/15/32294/137622/63e2fce7F205d8d51/40729560ede27307.jpg.avif, jfs/t1/107006/15/39932/134522/6442445bF6a64c121/5d170ee41e7c6e89.jpg.avif, jfs/t1/117157/35/31806/153661/63e2fe61F1cdac011/b87682a8261fb535.jpg.avif",,,,,4.9,10.90
100127342579,大白兔奶糖,,500+,大白兔奶糖京东自营专区,https://item.jd.com/100127342579.html,jfs/t1/182077/27/51417/67293/67343c9dFa318b0f8/bfe374f47402174d.jpg.avif,"jfs/t1/182077/27/51417/67293/67343c9dFa318b0f8/bfe374f47402174d.jpg.avif, jfs/t1/172459/35/51246/96841/67343c9dFe099ea9a/70c162e14535e13c.jpg.avif, jfs/t1/107715/31/56980/108721/67343c9dF8e1c299b/c68861ec01211d42.jpg.avif, jfs/t1/155969/26/50490/67293/67343c9cF1da04a07/bb22f40fc7725756.jpg.avif, jfs/t1/173967/12/48235/94210/67343c9cFda9421d4/85b0b65a46ce9888.jpg.avif",选择规格                                                ,"大白兔130g混合味礼盒, 大白兔130g原味礼盒, 大白兔200g圣诞节礼盒, 大白兔270g混合味礼盒, 大白兔270g原味礼盒, 大白兔300g混合味礼盒, 大白兔399克九口味蓝色礼盒, 大白兔399克九口味金色礼盒, 大白兔399克九口味粉色礼盒, 大白兔588克十二口味萌兔礼盒","jfs/t1/182077/27/51417/67293/67343c9dFa318b0f8/bfe374f47402174d.jpg.avif, jfs/t1/112268/31/52403/65127/67343ac2F9625172c/30ebc668998f8772.jpg.avif, jfs/t1/209976/27/50141/234608/67492e94F55b51ccf/9b76565fa8cf5c9a.jpg.avif, jfs/t1/243483/9/24988/70898/673ab3c4F013ec0af/66f6525c3ebdb0c7.jpg.avif, jfs/t1/221821/19/48252/87907/673ab201F8791bb32/6924a040d4301baa.jpg.avif, jfs/t1/197392/4/45174/163880/67344434Ffa78161e/43b9de2acb49a146.png.avif, jfs/t1/167763/40/51770/141554/673323d1Fe4066d80/fdf1e0e165a55a2a.jpg.avif, jfs/t1/238466/8/27637/185097/67512028F73b92d7a/a91df377bf615abe.jpg.avif, jfs/t1/242229/19/20951/187663/67330845F9b2e9568/7659749a449c5e63.jpg.avif, jfs/t1/243355/18/23535/187148/673405d4Ffbbb3f5b/5f09748705a9ab91.jpg.avif",,,,,5.0,11.90
