id,title,price,comment,shopName,url,img,img_list,attriName1,attriListName,attriListImg,attriName2,attriListSize,attriName3,attriListMode,shopRating,extraPrice
100021796667,朴西香蕉船情侣凉,,50万+,朴西京东自营旗舰店,https://item.jd.com/100021796667.html,jfs/t1/239879/19/13671/15935/668251d0Fe11c9061/15ca8f751494f3a0.jpg.avif,"jfs/t1/239879/19/13671/15935/668251d0Fe11c9061/15ca8f751494f3a0.jpg.avif, jfs/t1/169495/29/37199/45767/64312847F4e2e1873/1ea70c5a7d1dff1d.jpg.avif, jfs/t1/108862/35/38994/45791/64312848F876a6f37/df4b1ecaf4356071.jpg.avif, jfs/t1/118770/35/34863/49935/64312848F48220dae/c22b91f0054db8b5.jpg.avif, jfs/t1/209578/24/31010/47386/64312849F151f9b29/e977695260c41bc8.jpg.avif",选择颜色                                                ,"绿色, 黑色, 红色, 米色, 黄色, 黑色., 浅粉, 深灰","jfs/t1/148432/13/37843/20163/668251d2F79ae8dae/b4ca8a042e3f17f2.jpg.avif, jfs/t1/239879/19/13671/15935/668251d0Fe11c9061/15ca8f751494f3a0.jpg.avif, jfs/t1/243534/16/13494/21942/668251d0F7df7c441/f3a04afd21489a7a.jpg.avif, jfs/t1/243470/4/13756/18798/668251d2F932bace5/a1830cedf81bfea0.jpg.avif, jfs/t1/244552/20/13780/18025/668251d1Ff8b02c34/9dac6253e57460e9.jpg.avif, jfs/t1/239879/19/13671/15935/668251d0Fe11c9061/15ca8f751494f3a0.jpg.avif, jfs/t1/181142/36/47007/14046/668251d0F75e989d0/e97c9c25e4d4f58e.jpg.avif, jfs/t1/222509/3/34728/17278/668251d1F21772c60/48573e9f10db24a6.jpg.avif",选择尺码                                                ,"35-36, 37-38, 39-40, 40-41, 42-43, 44-45",,,5.0,29.80
32451531476,品赫（PIN HE）棉拖男鞋秋冬季家居棉,,10万+,品赫男鞋专卖店,https://item.jd.com/32451531476.html,jfs/t1/144597/33/31384/176364/63637488E65f45241/a0b18a05b1467618.jpg.avif,"jfs/t1/144597/33/31384/176364/63637488E65f45241/a0b18a05b1467618.jpg.avif, jfs/t1/207267/12/5770/206171/616d1b5aEa8e2d9ce/f469050b8685ef80.jpg.avif, jfs/t1/199425/5/13578/220170/616d1b5cEd9f2b55c/3bceb2fe93f46c52.jpg.avif",选择颜色                                                ,"M997酒红, 六边形白色, QR粉红, 六边形灰色, 六边形咖啡, M997粉红, 兔毛紫色, QR黄色, 兔毛灰色, 六边形侧缝咖啡, A002粉色, 兔毛咖色, QR灰色, 兔毛皮红, 六边形侧缝粉色, 六边形粉色, M997咖啡, QR卡其, A002灰色, 随机款式一双（介意勿拍）, M997灰色, 六边形侧缝灰色, A002藏青, 六边形侧缝白色","jfs/t1/126506/38/14059/180634/5f782073E730c11da/11b996c8405832c6.jpg.avif, jfs/t1/168461/32/40177/69030/650befd1F7f30ba54/c5e7c31f77dc204a.jpg.avif, jfs/t1/205539/10/12470/201213/6172b957E954f08c5/55d92ec25816fd0c.jpg.avif, jfs/t1/71795/34/24443/102279/650bf01eF57cc1cbc/ea63da084d043213.jpg.avif, jfs/t1/89318/1/32758/99150/650bf029F34881a6f/899b9af1893e9eb2.jpg.avif, jfs/t1/114573/12/19374/213288/5f782099E0d385f8b/6c97635ccb11da8f.jpg.avif, jfs/t1/6380/31/19285/206283/616d1b5cE1e03f442/9abd78a1d030033f.jpg.avif, jfs/t1/216061/12/1515/152984/6172b99cEf0dc6c9e/ede821e8f9110e8f.jpg.avif, jfs/t1/144597/33/31384/176364/63637488E65f45241/a0b18a05b1467618.jpg.avif, jfs/t1/98768/25/44400/137855/650bf03bF3d7d5f1f/f1d661b573fbdada.jpg.avif, jfs/t1/116085/3/30774/73610/6363771eE01532feb/c9be46f3a24d1289.jpg.avif, jfs/t1/158794/25/23937/206953/616d1b5aE7267af32/14a2e89325abf98c.jpg.avif, jfs/t1/131365/18/20788/220422/6172b9bbE5f487be2/849250c862842f41.jpg.avif, jfs/t1/218291/40/820/201124/616d1b5bE1deae947/e43f58d1634d2fd8.jpg.avif, jfs/t1/177485/21/38832/112929/650bf053F24f77807/837f4bf73e515624.jpg.avif, jfs/t1/182044/23/37967/86744/650bf05dF00c87348/b6d06c27a644febd.jpg.avif, jfs/t1/153745/35/1317/236428/5f7820d9E40eda1ef/100768fc9bac97df.jpg.avif, jfs/t1/170461/7/21311/215735/6172b9ceE72ce4800/09d51f12051bdf02.jpg.avif, jfs/t1/148465/13/27319/68772/636376d7E879fbbfc/eb984587556f449f.jpg.avif, jfs/t1/215575/30/11301/250893/61e9133aE66e62b85/85aa858c4843f098.jpg.avif, jfs/t1/128282/15/14263/233903/5f78210bE036837b6/082c63c8e72f4d2a.jpg.avif, jfs/t1/122719/21/38590/132441/650bf074F7f6f0ed2/7adf2f063a38cece.jpg.avif, jfs/t1/139287/12/31115/66513/636376fdEa8e9f47a/ddd119f51628126d.jpg.avif, jfs/t1/95509/24/41483/116523/650bf082Fb6d78c44/afcdc6c50931973d.jpg.avif",选择尺码                                                ,"270mm 适合39-40的脚, 280mm 适合41-42的脚, 290mm 适合43-44脚, 250mm 适合35-36的脚, 260mm 适合37-38的脚",,,4.7,6.90
100108540215,LURAD厚底室内,,2万+,LURAD京东自营旗舰店,https://item.jd.com/100108540215.html,jfs/t1/246599/35/13692/38807/668213b5Fc262d460/22fe2a7c10139ae8.jpg.avif,"jfs/t1/246599/35/13692/38807/668213b5Fc262d460/22fe2a7c10139ae8.jpg.avif, jfs/t1/176832/19/47109/49759/668213b3F6257f4b9/7df799652a7ce5dd.jpg.avif, jfs/t1/224033/8/36722/24898/668213b6Fc20f30b8/d6ac2bfc212daa6c.jpg.avif, jfs/t1/123842/20/47473/107800/66d01850F4ebdc73c/08b9afee44b00c58.jpg.avif, jfs/t1/234065/17/21173/39496/668213b7F00f2d610/b6bde377dd342f16.jpg.avif",选择颜色                                                ,"粉色, 绿色, 黄色, 黑色","jfs/t1/244455/33/12975/54332/66821480Fc77bc744/bd34eb2ed8b0fcba.jpg.avif, jfs/t1/246599/35/13692/38807/668213b5Fc262d460/22fe2a7c10139ae8.jpg.avif, jfs/t1/176818/5/47038/24597/66821480F94d96218/dce70f9edc351e1f.jpg.avif, jfs/t1/239165/22/12165/44533/66820f00F1297b566/942aa606c084f947.jpg.avif",选择尺码                                                ,"235mm(36-37), 245mm(38-39), 255mm(40-41), 265mm(42-43), 275mm(44-45)",,,5.0,16.90
100137829016,梦庭,,1000+,梦庭京东自营旗舰店,https://item.jd.com/100137829016.html,jfs/t1/195534/11/53077/188758/67498185Fdd1c3361/bdec68a13e6a5f79.jpg.avif,"jfs/t1/195534/11/53077/188758/67498185Fdd1c3361/bdec68a13e6a5f79.jpg.avif, jfs/t1/243046/6/17943/47473/66d120d4F9a02515e/596287392fb4e84b.jpg.avif, jfs/t1/52882/33/26654/23082/66d11e81F6f4b1d8e/771801df03be7c46.jpg.avif, jfs/t1/101985/33/53742/168002/6711be8dF5ca78edd/752286975539d2b6.png.avif",选择颜色                                                ,"【厚底防滑】黑色 40-41码, 【厚底防滑】黑色 42-43码, 【厚底防滑】黑色 44-45码, 【厚底防滑】咖色 40-41码, 【厚底防滑】咖色 42-43码, 【厚底防滑】咖色 44-45码","jfs/t1/235809/10/29033/126633/67498196Fd2ae69c8/d882c8e6d2d7c7c0.jpg.avif, jfs/t1/154837/30/37886/127537/67498182F5446e872/79debb9d8059f647.jpg.avif, jfs/t1/178837/2/52269/126756/67498188F1f0dc7fe/267434f9535c344a.jpg.avif, jfs/t1/244225/9/24924/187978/67498190F15db4fbe/65fcb0e064e27e2d.jpg.avif, jfs/t1/195534/11/53077/188758/67498185Fdd1c3361/bdec68a13e6a5f79.jpg.avif, jfs/t1/222122/8/50357/187891/6749818bFd14a05d4/be69cba1b27cb883.jpg.avif",,,,,5.0,9.90
100139876754,巴拉巴拉儿童,,500+,巴拉巴拉京东自营旗舰店,https://item.jd.com/100139876754.html,jfs/t1/231112/17/28436/154604/6749d1e2F16f37482/e435c55801b7e651.jpg.avif,"jfs/t1/199267/6/50875/154100/675059e0F3153ac40/b4e9f78368aa2955.jpg.avif, jfs/t1/186039/15/47730/138572/66e52080F52cc41be/af47f8055a820085.jpg.avif, jfs/t1/130630/17/45578/118704/66e5208eF539c783c/b604e557c506f0ac.jpg.avif, jfs/t1/229633/17/25038/128869/66e5208eFa3f7ffc4/b099538211de1062.jpg.avif, jfs/t1/88328/4/51898/177099/66e52093F5e2196da/87e5a3b1db1600d2.jpg.avif",选择颜色                                                ,"灰色调00322, 浅土黄30701, 卡其50601, 粉红60001, 黑色90001","jfs/t1/246896/39/27667/114389/675059e1Fef38651e/86714f513f0992a2.jpg.avif, jfs/t1/199267/6/50875/154100/675059e0F3153ac40/b4e9f78368aa2955.jpg.avif, jfs/t1/186339/38/53983/113717/675059d2F07b68e03/094052b4b65526b1.jpg.avif, jfs/t1/198042/34/52974/123357/675059e0F46707011/6bca25d81965035a.jpg.avif, jfs/t1/199421/22/50259/110965/675059cfF22a6e8ae/630a6ccdaa839ab5.jpg.avif",选择尺码                                                ,"21码(脚长12.8-13.2/内长14.2), 22码(脚长13.3-13.7/内长14.7), 23码(脚长13.8-14.2/内长15.2), 24码(脚长14.3-14.7/内长15.7), 25码(脚长14.8-15.3/内长16.4), 26码(脚长15.4-16/内长17), 27码(脚长16.1-16.7/内长17.7), 28码(脚长16.8-17.3/内长18.4), 29码(脚长17.4-18/内长19), 30码(脚长18.1-18.7/内长19.7)",,,5.0,129.91
10118498747937,回力官方,,100+,回力官方旗舰店,https://item.jd.com/10118498747937.html,jfs/t1/209626/10/49415/153590/67456225Fa507a064/bae69691bdbcd31a.jpg.avif,"jfs/t1/209626/10/49415/153590/67456225Fa507a064/bae69691bdbcd31a.jpg.avif, jfs/t1/189473/22/48411/304517/67087d47Fbe8b8f21/a412c8488e804ac1.jpg.avif, jfs/t1/229635/13/25526/90541/6715b12fF10aec74d/488308993454be8e.jpg.avif, jfs/t1/6891/28/34731/139691/66f65b47Fd038f14c/e764eacab6f6c74d.jpg.avif, jfs/t1/176372/23/48092/109026/66f65b43F6709c950/4e94b628b6a333ea.jpg.avif",选择颜色                                                ,"浅卡其【加绒加厚 防寒保暖】, 黑色【加绒加厚 防寒保暖】, 0598驼色【防寒保暖】, 0598棕色【防寒保暖】, 0598黑色【防寒保暖】","jfs/t1/209626/10/49415/153590/67456225Fa507a064/bae69691bdbcd31a.jpg.avif, jfs/t1/172328/24/52006/102157/67456247Ffabb0dbe/54905d828cfe6f79.jpg.avif, jfs/t1/226253/27/3001/128834/6554747eFd6385235/93df7abc82868a8b.jpg.avif, jfs/t1/226715/17/3417/119950/655474f9Fdcb43e33/5b42f1693d80b8fb.jpg.avif, jfs/t1/235977/4/8666/96290/657e9cbaF79c77b39/9826328cecfa62b4.jpg.avif",选择尺码                                                ,"35, 36, 37, 38, 39, 40",,,,79.80
10119445961850,环球厚底,,500+,环球椒椒专卖店,https://item.jd.com/10119445961850.html,jfs/t1/128469/16/47932/113548/67024194Ff5ba24ec/dc3c3a3e848309c9.jpg.avif,"jfs/t1/128469/16/47932/113548/67024194Ff5ba24ec/dc3c3a3e848309c9.jpg.avif, jfs/t1/222001/40/47610/47468/673be0a5Feb0f6933/01d2dd4a9ec07b03.jpg.avif, jfs/t1/150028/22/48913/171622/673b0679Fe67e7685/3b0bed407fbfbe21.jpg.avif, jfs/t1/243676/11/17344/190177/673b0679Fdc417a94/260602919e60fe66.jpg.avif, jfs/t1/164931/35/49643/169956/673b0678F29c41bb5/a5359a6f59eb190e.jpg.avif",选择颜色                                                ,"驼色, 米色","jfs/t1/128469/16/47932/113548/67024194Ff5ba24ec/dc3c3a3e848309c9.jpg.avif, jfs/t1/149884/11/44591/83044/67024197F7dbbae93/526a6e80a251a0b4.jpg.avif",选择尺码                                                ,"35 （尺码偏小，建议拍大一码）, 36 （尺码偏小，建议拍大一码）, 37 （尺码偏小，建议拍大一码）, 38 （尺码偏小，建议拍大一码）, 39 （尺码偏小，建议拍大一码）, 40 （尺码偏小，建议拍大一码）, 41 （尺码偏小，建议拍大一码）",,,4.5,79.00
10091165652417,JOMC可爱防滑厚底,,500+,JOMC鞋业旗舰店,https://item.jd.com/10091165652417.html,jfs/t1/186004/2/48261/58927/6723003eF28f7bd8b/548b24555d0ccbcf.jpg.avif,"jfs/t1/186004/2/48261/58927/6723003eF28f7bd8b/548b24555d0ccbcf.jpg.avif, jfs/t1/160288/25/50817/99059/6723003fF8338499c/06cca80d14979a4a.jpg.avif, jfs/t1/216409/17/46574/72215/67230040F0291e39f/622854975ed99274.jpg.avif, jfs/t1/107772/40/53431/173805/67230042F7950c837/995dba08d5b7a856.jpg.avif, jfs/t1/91213/31/50654/44787/67230042Fb3ef27b3/cf260f244902ff29.jpg.avif",选择颜色                                                ,"棕色, 米白色","jfs/t1/160288/25/50817/99059/6723003fF8338499c/06cca80d14979a4a.jpg.avif, jfs/t1/186004/2/48261/58927/6723003eF28f7bd8b/548b24555d0ccbcf.jpg.avif",选择尺码                                                ,"35, 36, 37, 38, 39, 40",,,,65.32
10091442576990,回力瑞保暖毛毛,,500+,曼联鞋靴专营店,https://item.jd.com/10091442576990.html,jfs/t1/198237/26/45666/156325/6703e02aF09bbbe15/b026bcaab22c9bf4.jpg.avif,"jfs/t1/198237/26/45666/156325/6703e02aF09bbbe15/b026bcaab22c9bf4.jpg.avif, jfs/t1/177968/9/42094/142888/65542b62F4357de46/6ef9ce5e90974deb.jpg.avif, jfs/t1/106797/34/43577/122773/65542b63F05a688c0/da1c2e7a68fd2c8f.jpg.avif, jfs/t1/226861/18/3416/135338/65542b64F9d12e1f0/9a60a3704bf715e9.jpg.avif, jfs/t1/230750/17/3139/111801/65542b65F7127910d/4427f72b36948cad.jpg.avif",选择颜色                                                ,"米白色, 棕色","jfs/t1/198237/26/45666/156325/6703e02aF09bbbe15/b026bcaab22c9bf4.jpg.avif, jfs/t1/236633/37/26769/54964/6703e029Fc92f3726/79d16ab7a6b448ec.jpg.avif",选择尺码                                                ,"35, 36, 37, 38, 39, 40",,,,57.21
100043509175,回力官方,,1万+,回力Warrior京东自营旗舰店,https://item.jd.com/100043509175.html,jfs/t1/217820/26/45288/117763/6718e225F1f04fb41/25b06c8e504b2c60.jpg.avif,"jfs/t1/247228/33/27324/122268/6751405dF9ce64717/de6f6e1d563e7e17.jpg.avif, jfs/t1/187680/12/49634/130863/6718e226F2bcae8de/d4eebba417fa116f.jpg.avif, jfs/t1/122438/14/50402/113367/6718e227F8b3b0b5e/b569d61ea495eaf9.jpg.avif, jfs/t1/135096/9/50020/143973/6718e227F2382b2e5/7a462e78f4d3b762.jpg.avif, jfs/t1/241115/30/21161/172706/6718e227F1dabd965/a267c199b7efd9c0.jpg.avif",选择颜色                                                ,"绒面/黑色, 绒面/灰色, 绒面/棕色, 皮面/黑色, 皮面/灰色, 皮面/棕色","jfs/t1/247228/33/27324/122268/6751405dF9ce64717/de6f6e1d563e7e17.jpg.avif, jfs/t1/156144/11/50204/138944/6718e2b1Fa15c36d3/d563be12f11bed13.jpg.avif, jfs/t1/241317/21/19834/176551/6718e2d5F507bb68a/ae93652e70a53bb4.jpg.avif, jfs/t1/224874/9/27177/133890/6718e392F6ea21a6a/5102a7a8fa64a908.jpg.avif, jfs/t1/163067/34/48921/123220/6718e44fF409ddc5e/8c24f51d6f135157.jpg.avif, jfs/t1/208946/37/32876/118339/6718e480Fbfb7e7c1/2b823cc8936d0297.jpg.avif",选择尺码                                                ,"39, 40, 41, 42, 43, 44",,,5.0,99.90
100144140264,足力健老人鞋冬季加厚保暖,,2000+,足力健京东自营官方旗舰店,https://item.jd.com/100144140264.html,jfs/t1/175068/35/54509/135384/67497367Fb67c5ab3/ebd146a405135ff2.jpg.avif,"jfs/t1/242155/36/26252/130485/67502eefF09e4b27c/2622afee9418216f.jpg.avif, jfs/t1/195459/19/49058/120840/66f8bce8Fc740276f/f8554c5f80c5dcbf.jpg.avif, jfs/t1/166647/8/48074/185110/66f8bce9F10b6fcf3/77ad035e46bca008.jpg.avif, jfs/t1/156828/33/46376/175618/66f8bceaF8c2e3dc6/fc2dede498c6db65.jpg.avif, jfs/t1/103002/18/50936/145618/66f8bceaF0020b7bf/42477287cc67194c.jpg.avif",选择颜色                                                ,"男-休闲蓝, 女-车厘子红","//img14.360buyimg.com/n9/s60x80_jfs/t1/191542/21/55293/162897/67502eacFf7d4ecd6/399c8ee7ba552c7d.jpg.avif, //img14.360buyimg.com/n9/s60x80_jfs/t1/242155/36/26252/130485/67502eefF09e4b27c/2622afee9418216f.jpg.avif",选择尺码                                                ,"42, 43, 44, 45, 35, 36, 37, 38, 39, 40, 41",,,5.0,386.00
10087532580067,回力,,5000+,回力男鞋旗舰店,https://item.jd.com/10087532580067.html,jfs/t1/233100/38/2939/109086/6551e53aFb667778e/9f6c9e818cf090e7.jpg.avif,"jfs/t1/233100/38/2939/109086/6551e53aFb667778e/9f6c9e818cf090e7.jpg.avif, jfs/t1/224879/37/3291/103178/6551e538F7be957b3/1e8002587d8c8c5c.jpg.avif, jfs/t1/224131/34/7079/152785/65727838Ffe783172/aa69d6cb4d2dddf1.jpg.avif, jfs/t1/125740/11/39314/195210/6551e538F7f25e5da/71fec6a7129e2280.jpg.avif, jfs/t1/227271/16/2955/101513/6551e537F3d73bdaf/81333c4f9a901ebb.jpg.avif",选择颜色                                                ,"黑色 【保暖皮面】, 灰色 【保暖皮面】, 棕色 【保暖皮面】, 黑色 【皮面搭扣】, 黑色 【潮流搭扣】, 灰色 【潮流搭扣】, 咖色 【潮流搭扣】, 黑色 【基础百搭】, 灰色 【基础百搭】, 棕色 【基础百搭】, 黑色 【简约中筒】, 灰色 【简约中筒】, 棕色 【简约中筒】, 黑色 【皮面鞋提】, 灰色 【皮面鞋提】, 棕色 【皮面鞋提】","jfs/t1/233100/38/2939/109086/6551e53aFb667778e/9f6c9e818cf090e7.jpg.avif, jfs/t1/199559/34/38221/148624/6551e55eF2e58265c/a9a88cf9dc6f67db.jpg.avif, jfs/t1/6217/13/35916/144382/6551e583F8f908213/f8d985e8668d86c7.jpg.avif, jfs/t1/179176/4/41103/90681/6551e5a7F62b1fc45/5026134cd20ce4e9.jpg.avif, jfs/t1/108117/27/29763/175466/6551e5ceF364b49d1/6d4d4c53d159e0ea.jpg.avif, jfs/t1/231576/33/2896/121457/6551e5f0F918c6233/f634cbaf4812c3b8.jpg.avif, jfs/t1/89738/26/43596/167200/6551e619F4a955e30/80668d6c449ce20b.jpg.avif, jfs/t1/195752/24/42586/106117/6552d9b9F6a6733b8/0ac28d32ed944fef.jpg.avif, jfs/t1/101779/33/44081/190688/65571345F6d7131c6/a07f047b2f9aee4e.jpg.avif, jfs/t1/89264/40/32245/162607/6552d9aaFc966f671/0c236f78d6830dfb.jpg.avif, jfs/t1/236029/36/2719/181462/6551e63eF94e8f9a3/39ac2f50322abaf6.jpg.avif, jfs/t1/115417/30/39158/130881/6551e67aFca72238e/ac1710ead82253e6.jpg.avif, jfs/t1/223199/12/34051/148233/65571983F72d13fec/8e90e1fb9d4380bb.jpg.avif, jfs/t1/179619/11/49305/178445/671306f9F3bb77566/5cc057a19b84b513.jpg.avif, jfs/t1/147646/39/48061/124325/671306f1Fdba9233a/f8b6bafbcf93ca1d.jpg.avif, jfs/t1/205488/7/46361/119530/671306ecF945fda44/12519bf2f69fbcf7.jpg.avif",选择尺码                                                ,"39, 40, 41, 42, 43, 44",,,4.9,79.90
10119128229478,回力官方,,200+,回力官方旗舰店,https://item.jd.com/10119128229478.html,jfs/t1/242029/14/20297/84017/67219840F8d3e3efe/2d5869dfd228838d.jpg.avif,"jfs/t1/242029/14/20297/84017/67219840F8d3e3efe/2d5869dfd228838d.jpg.avif, jfs/t1/189405/7/48830/58686/66fe3eb4F5dd837cd/8785d1b0b3b5b74a.jpg.avif, jfs/t1/248134/35/21651/116507/671af520Fc587f27d/e92f33cf1b83a721.jpg.avif, jfs/t1/49791/20/26712/65766/67219861Fb269e341/0876152ee61c3fdf.jpg.avif, jfs/t1/210006/8/44825/136393/66fe3eb6F871c46f1/4f89ee0b1caffcbc.jpg.avif",选择颜色                                                ,"白色【内里加绒】, 黑色【内里加绒】, 米色【内里加绒】, 米色/1984, 黑色/1984, 米色/2209, 黑色/2209, 黑色【时尚搭扣款】, 灰色【时尚搭扣款】, 卡其色【时尚搭扣款】","jfs/t1/242029/14/20297/84017/67219840F8d3e3efe/2d5869dfd228838d.jpg.avif, jfs/t1/235631/30/27436/80288/66fe3fddFb532c9d6/6d0f743eefedb3bc.jpg.avif, jfs/t1/123429/18/49333/85039/66fe40c0Ff847331d/e810ea377d9a952a.jpg.avif, jfs/t1/240339/22/24140/73702/67384a39F373e08b6/7eff73084ee91735.jpg.avif, jfs/t1/149307/31/48942/126634/67384b6cF96ebeed9/5a08909fc5faacf8.jpg.avif, jfs/t1/134158/10/46137/220044/67384f24F9f4c8d40/0eb2d192cf3ac7b2.jpg.avif, jfs/t1/148506/31/47566/120479/67384f61F758653dd/e9f1c095802348b8.jpg.avif, jfs/t1/168009/35/47907/268895/67289774F51e2742c/87ed26e2c49583b1.jpg.avif, jfs/t1/198793/2/46939/293210/6728984bF8518cf60/92a5989cc1e7db57.jpg.avif, jfs/t1/96713/4/55429/215572/67289a25F4f0767a9/e6780b2b8092b0e6.jpg.avif",选择尺码                                                ,"35, 36, 37, 38, 39, 40",,,,99.00
10089167768869,达芙妮,,2000+,达芙妮庞卫专卖店,https://item.jd.com/10089167768869.html,jfs/t1/192488/32/54761/141332/675027ccFe78f074e/fd7d597dfeba80e6.jpg.avif,"jfs/t1/192488/32/54761/141332/675027ccFe78f074e/fd7d597dfeba80e6.jpg.avif, jfs/t1/102455/21/37099/72696/65376d1aF4a456cbc/8f1bcce3894f01f4.jpg.avif, jfs/t1/224636/6/1110/180613/65376ed0F4ebd0e13/e0103d588e94fd23.jpg.avif, jfs/t1/229692/24/629/130826/65376ed0Fabc8465a/90e89724d1da1b80.jpg.avif, jfs/t1/159939/4/35396/103650/65376ed1F26a5cf65/9e6d1f09a91f9944.jpg.avif",选择颜色                                                ,"栗色, 卡其色, 卡绿","jfs/t1/192488/32/54761/141332/675027ccFe78f074e/fd7d597dfeba80e6.jpg.avif, jfs/t1/242308/30/18662/130140/675027ceFd53d330b/2a2de286506a6be6.jpg.avif, jfs/t1/246697/11/27732/112327/675027d0F8c417955/a2aad3a8a4825cc7.jpg.avif",选择尺码                                                ,"35 标准码, 36 标准码, 37 标准码, 38 标准码, 39 标准码, 40 标准码",,,,169.00
10084482108255,达芙妮（DAPHNE）厚底,,1000+,达芙妮奥域专卖店,https://item.jd.com/10084482108255.html,jfs/t1/239364/6/25859/105092/674fee54F2d196f3b/b97052aeecdeb434.jpg.avif,"jfs/t1/241057/31/26139/102788/6752d1ceFfcba32db/76051ca84120614b.jpg.avif, jfs/t1/181840/8/48111/65942/66fa0ba7Fc5bfc0b5/433ea464cf6d09f1.jpg.avif, jfs/t1/210382/29/47345/169200/672d8167Fde2997c2/4cfb5703ae37d3fd.jpg.avif, jfs/t1/228521/3/27795/98266/66fa0b32Fc8941066/409504884b2e3717.jpg.avif, jfs/t1/248390/17/23434/84392/672d8166Fa2e7d41c/e7cb540fb7c839a2.jpg.avif",选择颜色                                                ,"D924090栗色【柔软毛绒】, D924090杏色【柔软毛绒】, D924090淤泥灰色【柔软毛绒】, D924090米色【柔软毛绒】, D924090羚羊粽【柔软毛绒】, D924090黑色【柔软毛绒】, D934045栗色【防水防滑】, D934092栗色【短款帮高】, D934092杏色【短款帮高】","//img10.360buyimg.com/n9/s60x80_jfs/t1/241057/31/26139/102788/6752d1ceFfcba32db/76051ca84120614b.jpg.avif, //img13.360buyimg.com/n9/s60x80_jfs/t1/222999/10/46030/112846/6752d1cfF55fbf443/1066aaa602478f8d.jpg.avif, //img13.360buyimg.com/n9/s60x80_jfs/t1/204443/14/53543/149308/6752d1d6F3d3aeee9/0b493846c763535b.jpg.avif, //img14.360buyimg.com/n9/s60x80_jfs/t1/246078/19/26315/91310/6752d1d7F6691da16/7bfc312a331856f7.jpg.avif, //img12.360buyimg.com/n9/s60x80_jfs/t1/150055/8/47044/91454/6752d1d8Fcff36b9c/fbb991f277cccee4.jpg.avif, //img11.360buyimg.com/n9/s60x80_jfs/t1/240473/1/25367/131516/6752d1d1Fae769b9a/7c091655c7b61075.jpg.avif, //img14.360buyimg.com/n9/s60x80_jfs/t1/185594/26/54191/91200/6752d1d2Fc6114639/8bf1b1620f4e1fbb.jpg.avif, //img10.360buyimg.com/n9/s60x80_jfs/t1/240275/15/27282/108167/6752d1d3F4bf39e98/6a0765d5b8785ad4.jpg.avif, //img13.360buyimg.com/n9/s60x80_jfs/t1/208812/40/49672/100417/6752d1d5F89206944/8389f35460c67a8c.jpg.avif",选择尺码                                                ,"34, 35, 36, 37, 38, 39, 40, 41",,,,161.00
100070608715,Dickies女士,,2000+,Dickies鞋靴京东自营旗舰店,https://item.jd.com/100070608715.html,jfs/t1/149490/32/48337/73548/674944ebFf63972e0/a090d653fdc2d00e.jpg.avif,"jfs/t1/243677/21/27006/74160/67525f12F84de676f/b97a253760d080bb.jpg.avif, jfs/t1/236031/5/8048/40435/657badbaFc007b1ca/8adb2d26913b94b3.jpg.avif, jfs/t1/231244/9/8693/33328/657badbaF3a088d3b/68a93d84b3136403.jpg.avif, jfs/t1/237404/26/8354/30726/657badeeFdc8c8eb9/dde9ab86f7537d0d.jpg.avif, jfs/t1/227924/37/8644/99416/657badefF42dde970/a200a3cd114ac5bf.jpg.avif",选择颜色                                                ,"黑色, 杏色, 米色","//img12.360buyimg.com/n9/s60x80_jfs/t1/246680/32/23996/68642/67525f17F43ece87a/3b1e4455b5290be5.jpg.avif, //img11.360buyimg.com/n9/s60x80_jfs/t1/211429/40/51465/83363/67525f2cF13fbe182/8336f20b06b9b780.jpg.avif, //img10.360buyimg.com/n9/s60x80_jfs/t1/243677/21/27006/74160/67525f12F84de676f/b97a253760d080bb.jpg.avif",选择尺码                                                ,"35, 36, 37, 38, 39, 40",,,5.0,399.00
10119434754640,洁丽雅厚底,,500+,洁丽雅家居鞋旗舰店,https://item.jd.com/10119434754640.html,jfs/t1/191436/37/52862/256879/6746aea1Fed03f8dd/b3349c47e82e5ae9.jpg.avif,"jfs/t1/191436/37/52862/256879/6746aea1Fed03f8dd/b3349c47e82e5ae9.jpg.avif, jfs/t1/174363/26/50207/155714/673d9eb0Fd539658a/6427873300888c23.jpg.avif, jfs/t1/179210/5/51979/253499/67396214F59f1b558/c52841aa9c04c8f4.jpg.avif, jfs/t1/134545/29/49067/341473/6707c11fFb427c332/6de01c79620362e2.jpg.avif, jfs/t1/168320/6/49504/280949/6707c124Fc2f00990/32c8728d667df277.jpg.avif",选择颜色                                                ,"棕色, 卡其色, 黑色","jfs/t1/191436/37/52862/256879/6746aea1Fed03f8dd/b3349c47e82e5ae9.jpg.avif, jfs/t1/165460/39/49085/330564/6707c18bF864399b6/9a47445a0a64ab64.jpg.avif, jfs/t1/243261/34/19978/300048/6707c126Fabec462e/26d855f95b1f06f0.jpg.avif",选择尺码                                                ,"35 【适合34码】, 36 【适合35码】, 37 【适合36码】, 38 【适合37码】, 39 【适合38码】, 40 【适合39码】",,,4.9,69.00
10109856668599,拉夏贝尔厚底,,1000+,拉夏贝尔女鞋官方旗舰店,https://item.jd.com/10109856668599.html,jfs/t1/178926/11/42438/88312/654b0151F01841516/f2fe554054c0300a.jpg.avif,"jfs/t1/178926/11/42438/88312/654b0151F01841516/f2fe554054c0300a.jpg.avif, jfs/t1/229898/8/2021/120793/654b0150F3d42351d/59363d47b2190912.jpg.avif, jfs/t1/108409/35/32842/76816/654b015fF6fe92551/0d0cbf87cbeb10b2.jpg.avif, jfs/t1/233207/16/2259/58517/654b015eF7a8746f5/83c5420ddbff8251.jpg.avif, jfs/t1/182083/10/42260/67247/654b015eFae2f6ba0/6de513818c05f894.jpg.avif",选择颜色                                                ,"驼色 0424, 黑色 0424, 驼色 1050, 卡其色 1050, 灰色 1050, 驼色 1020, 卡其色 1020, 黑色 1020","jfs/t1/178926/11/42438/88312/654b0151F01841516/f2fe554054c0300a.jpg.avif, jfs/t1/90135/5/19339/74337/654b015bF6cf22ca8/768058562f917b5d.jpg.avif, jfs/t1/172048/37/48670/165010/67149ed3F3a176639/470771e6de32578c.jpg.avif, jfs/t1/186526/1/49465/169537/67149ed6F962a6cea/64c5a594ad6ab3fb.jpg.avif, jfs/t1/218789/19/46067/103917/67149ec3Fc5a9047f/1feac92a88715d94.jpg.avif, jfs/t1/187048/24/48709/220624/671210fbFedd6c30b/8277c571e1414d1c.jpg.avif, jfs/t1/177076/26/49474/104951/67121101F400e9a02/61ba8c9d7657833f.jpg.avif, jfs/t1/136845/32/48154/88706/671210faF0fcc14b6/c11efaef6d8a9853.jpg.avif",选择尺码                                                ,"35, 36, 37, 38, 39, 40",,,,99.00
