id,title,price,comment,shopName,url,img,img_list,attriName1,attriListName,attriListImg,attriName2,attriListSize,attriName3,attriListMode,shopRating
10123567030275,志高（CHIGO）全自动,358.90,20万+,志高冰箱洗衣机旗舰店,https://item.jd.com/10123567030275.html,jfs/t1/186505/17/49979/144313/67274b67F5b1f9189/6c6562470a9a13a3.jpg.avif,"jfs/t1/186505/17/49979/144313/67274b67F5b1f9189/6c6562470a9a13a3.jpg.avif, jfs/t1/196117/28/46852/82766/6679b58bFbb34f3e1/917fe97ed1ae15cf.jpg.avif, jfs/t1/237436/22/26157/113488/6717cba4Fc3199da2/3f24ef754c9699c9.jpg.avif, jfs/t1/208097/28/45674/111738/6717cba4F1e18f4a4/2fb7621ee96a93be.jpg.avif, jfs/t1/174988/37/49515/281031/6717cba6F2058ec42/a3f8c7dda6c9dc29.jpg.avif",选择款式                                                ,"【10Kg主销款-升级加厚-蓝光洗护-强动力电机】, 【11Kg-主销特惠款-蓝光洗护-强动力电机】, 【12Kg-特惠款-蓝光洗护-强动力电机】, 【11Kg特惠款-升级加厚-蓝光洗护-强动力电机】, 【13Kg-特惠款-蓝光洗护-强动力电机】, 【13Kg-玻璃面板-蓝光洗护-强动力电机】, 【13Kg热烘干-洗烘一体-强动力电机】, 【7.5Kg-主销款-智能风干-强动力电机】, 【7.5Kg主销款-升级加厚-智能风干强动力电机】, 【9Kg-特惠款-蓝光洗护-强动力电机】, 【6.5Kg实惠款-智能风干-强力去污】, 【15Kg大容量-蓝光洗护-强动力电机】, 【15Kg大容量玻璃盖板-蓝光洗护-强动力电机】, 【15Kg大容量热烘干-蓝光洗护-强动力电机】","jfs/t1/164949/6/50946/144312/67274b66F8944cc65/25c2d9c54574945b.jpg.avif, jfs/t1/10140/9/25528/93700/66c60942F7c5c700c/04b71c263edf098d.jpg.avif, jfs/t1/136088/1/49484/86326/6717cf93F90d28c31/e08f6f0981b19a42.jpg.avif, jfs/t1/10140/9/25528/93700/66c60942F7c5c700c/04b71c263edf098d.jpg.avif, jfs/t1/246239/4/17604/82976/66c60940F218a00ef/5a2edb9a1881d54d.jpg.avif, jfs/t1/105074/22/37565/83209/66c60940F20876ca6/56c5f0f4e0ca15c2.jpg.avif, jfs/t1/107754/13/50181/80936/66c6093fF98e871e6/98791cdcb153f76b.jpg.avif, jfs/t1/241995/32/21504/86235/672340afF7fbc2684/5c97c89314bfb232.jpg.avif, jfs/t1/241995/32/21504/86235/672340afF7fbc2684/5c97c89314bfb232.jpg.avif, jfs/t1/186505/17/49979/144313/67274b67F5b1f9189/6c6562470a9a13a3.jpg.avif, jfs/t1/236507/14/27910/74972/6717cba5Fe55d7289/ae74de721b9c83c2.jpg.avif, jfs/t1/240147/10/16867/82828/66c6093dF8ecdb4aa/296224509457e819.jpg.avif, jfs/t1/40188/28/23746/83060/66c6093eFdcfb3c5e/a09ec1aaa531650b.jpg.avif, jfs/t1/39697/26/21992/80787/66c6093dF237816d5/7da9d4fb89c00825.jpg.avif",,,,,4.8
10100792544138,YANGZI中国扬子集团波轮,349.00,2万+,YANGZI洗烘旗舰店,https://item.jd.com/10100792544138.html,jfs/t1/243828/23/22175/63183/674c34a0Fcf8ad6d1/b9e6bfc62b55252d.jpg.avif,"jfs/t1/243828/23/22175/63183/674c34a0Fcf8ad6d1/b9e6bfc62b55252d.jpg.avif, jfs/t1/132118/6/49958/89742/67187f0cF80afa679/1fedc6829d164bda.jpg.avif, jfs/t1/180535/8/50288/111892/67187f0cF9fef98d2/4844c3063c525c88.jpg.avif, jfs/t1/208215/30/45996/67813/67187f0bF7742d463/5d1d81f0b4c6ce77.jpg.avif, jfs/t1/229485/5/15711/69310/66139bedF21151aa3/c3c8d66229b74749.jpg.avif",选择款式                                                ,"10KG【蓝光洗护+智能风干+防缠绕】, 8KG【蓝光洗护+智能风干+防缠绕】, 8.5KG【蓝光洗护+智能风干+防缠绕】, 9.5KG【蓝光洗护+智能风干+防缠绕】, 11KG【蓝光洗护+智能风干+防缠绕】, 12KG【蓝光洗护+智能风干+防缠绕】, 13.5KG【蓝光洗护+智能风干+防缠绕】, 15KG【蓝光洗护+智能风干+防缠绕】","jfs/t1/243828/23/22175/63183/674c34a0Fcf8ad6d1/b9e6bfc62b55252d.jpg.avif, jfs/t1/248530/20/26630/78212/674d9cf4F5edc4831/359961f4bc6704d1.jpg.avif, jfs/t1/110813/28/53453/163803/674878c1F3f26ca3d/515495ee263eae28.jpg.avif, jfs/t1/220962/32/50186/163280/674878c0Fe0086880/6fa643f3d861d07b.jpg.avif, jfs/t1/200188/36/48499/162298/674878c0Fe0e8540e/2e90546e77b0e82e.jpg.avif, jfs/t1/218217/40/49127/165995/674878bfFe6b6a2e4/eb9403f9b4a991b5.jpg.avif, jfs/t1/208425/30/50116/166992/674878bfF7a4d1fba/182c7d0443d1ae35.jpg.avif, jfs/t1/224209/21/30510/165882/674878beF7cef33c3/3db35aa3a3508d6e.jpg.avif",,,,,4.4
10104572421206,志高半自动,358.00,2000+,多方达电器专营店,https://item.jd.com/10104572421206.html,jfs/t1/194335/39/52898/89430/673eb7baF99f8fc31/3a13da7a3f86e7d8.jpg.avif,"jfs/t1/194335/39/52898/89430/673eb7baF99f8fc31/3a13da7a3f86e7d8.jpg.avif, jfs/t1/159641/27/44596/67764/666c24baFd7b1d4ca/019f3e35cf50b2ba.jpg.avif, jfs/t1/246662/17/9417/55721/664f12b7F6adddffe/095979542f5b9d5d.png.avif, jfs/t1/181205/2/45945/34130/664f125aF287b6224/6d9f20586c8a375b.jpg.avif, jfs/t1/20492/26/22751/117732/669f72c6F640d8684/ec458c0860d28361.jpg.avif",选择款式                                                ,"14.5公斤｜强力去污【洗8.5+脱6】, 店长推荐｜16.0公斤｜强力去污【洗10+脱6】, 18.5公斤｜强力去污【洗12+脱6.5】, 14.5公斤｜玻璃盖板【洗8.5+脱6】, 16.0公斤｜玻璃盖板【洗10+脱6】, 18.5公斤｜玻璃盖板【洗12+脱6.5】, 19.5公斤｜玻璃盖板【洗13+脱6.5】, 19.5公斤｜强力去污【洗13+脱6.5】, 21.5公斤｜强力去污【洗15+脱6.5】, 22.5公斤｜强力去污【洗16+脱6.5】, 21.5公斤｜玻璃盖板【洗15+脱6.5】, 22.5公斤｜玻璃盖板【洗16+脱6.5】, 24.5公斤｜强力去污【洗18+脱6.5】, 24.5公斤｜玻璃盖板【洗18+脱6.5】","jfs/t1/196287/1/52825/89960/673eb7baF7a58f906/c1f79702f6a476f1.jpg.avif, jfs/t1/194335/39/52898/89430/673eb7baF99f8fc31/3a13da7a3f86e7d8.jpg.avif, jfs/t1/197728/27/45586/113057/67089ee7Fe8e929b0/40306b00cd1e2729.jpg.avif, jfs/t1/247664/32/14926/88304/6690e167F9b891987/a42069fcd3815a21.jpg.avif, jfs/t1/4334/9/20818/88284/6690e17eF5eeb732a/825db3b72f98534d.jpg.avif, jfs/t1/220477/11/42065/88957/666a9399Fe2a4c187/c64b56702cee793a.jpg.avif, jfs/t1/233112/19/18405/85494/666a939bFf28c4bcf/2a7278f63e33637a.jpg.avif, jfs/t1/247706/32/11271/84619/666a9398Fd08d66ac/951d6243a52dfa81.jpg.avif, jfs/t1/203012/11/44505/93797/666a939bFb8839ef9/f0a9dab2f7fa6ea7.jpg.avif, jfs/t1/236367/3/19454/97681/666a939aFe2fb162c/c2e9430e3d133924.jpg.avif, jfs/t1/217676/27/44232/90095/666a9398Ff29d0320/a2a9823bcfa0106e.jpg.avif, jfs/t1/239508/30/11486/89011/666a9397Fb31eb211/ef9ebe6033bf40a5.jpg.avif, jfs/t1/226544/37/18533/97539/666a939aFb8ec8512/76f7f768bf30b40e.jpg.avif, jfs/t1/185459/13/46916/89446/666a9397F7396929a/de914f67c8a63e3e.jpg.avif",,,,,4.3
4629832,TCL 7KG全自动波轮,529.00,50万+,TCL京东自营官方旗舰店,https://item.jd.com/4629832.html,jfs/t1/197985/21/51830/137597/674efabeF34ad3952/0f3147ed64d44dcd.jpg.avif,"jfs/t1/197985/21/51830/137597/674efabeF34ad3952/0f3147ed64d44dcd.jpg.avif, jfs/t1/241356/38/16112/261167/673ee9b2Fa123edec/baa2f34dd7a2e374.png.avif, jfs/t1/207987/38/48178/135784/6733fccaFecdbc465/6e8834eec60db542.jpg.avif, jfs/t1/200467/5/46194/115954/6711d713Fcc69a7c3/c3e4a26afb3c1d08.jpg.avif, jfs/t1/106640/7/53607/92319/6711d712Fb42fe354/bb3d2044bd772acb.jpg.avif",选择款式                                                ,"7KG|一键洗衣|小巧便捷, 10KG|抗菌波轮|感应电机, 10KG|抗菌波轮|直驱电机, 12KG大容量|抗菌除螨|全景视窗","jfs/t1/197985/21/51830/137597/674efabeF34ad3952/0f3147ed64d44dcd.jpg.avif, jfs/t1/240814/22/26167/141421/674efabeF1eec60f9/3c22dd1d1da8ca8d.jpg.avif, jfs/t1/175485/39/51742/140540/674efabfF22ac468a/1a459038af1803bc.jpg.avif, jfs/t1/197211/22/52126/147379/674efabfFd326a376/b5b5a50522bc3773.jpg.avif",,,,,5.0
100065712531,TCL 10KG除菌变频洗烘一体机L110高温煮洗 滚筒,1499.00,2万+,TCL京东自营官方旗舰店,https://item.jd.com/100065712531.html,jfs/t1/219479/11/50537/131197/674efac1Ff2cc0c65/59ad22b3e1bfaee2.jpg.avif,"jfs/t1/219479/11/50537/131197/674efac1Ff2cc0c65/59ad22b3e1bfaee2.jpg.avif, jfs/t1/224047/11/23276/260325/673ee9b2F76847931/9ab878ca48a9dfd0.png.avif, jfs/t1/223584/40/49048/143932/6733fcccF353b55cb/ce88373bd5e3fc19.jpg.avif, jfs/t1/238766/25/19721/104550/67121f6aFa658bcd7/3e81441ed6ab72e1.jpg.avif, jfs/t1/123802/19/50776/51437/6710e424F28e96c7e/131b7f12076f8d13.jpg.avif",选择款式                                                ,"7KG|超薄滚筒|智慧洗衣, 8KG|超薄滚筒|除菌除螨, 10KG|超薄滚筒|芭蕾白, 10KG|洗烘一体|芭蕾白, 10KG|超薄滚筒|巴氏除菌, 10KG|洗烘一体|巴氏除菌, 10KG|超薄滚筒|蒸汽除菌, 12KG全家桶|超薄滚筒|除菌除螨, 12KG全家桶|洗烘一体|除菌除螨, 10KG|洗烘一体|智能投放, 10KG|超薄滚筒|智能投放, 10KG|洗烘一体|高清彩屏, 10KG|超薄滚筒|高清彩屏, 10KG洗+10KG烘|套装|智能投放, 10KG洗+10KG烘|套装|超薄嵌入","jfs/t1/217109/19/51103/129513/674efabfFad2f425c/8951b1f51e081d74.jpg.avif, jfs/t1/200277/17/52011/152844/674f1ca4F5502817a/23267e930f2aa235.jpg.avif, jfs/t1/250500/25/22679/122464/674efabfF72fb0ac7/17f24e71bc8f0054.jpg.avif, jfs/t1/219479/11/50537/131197/674efac1Ff2cc0c65/59ad22b3e1bfaee2.jpg.avif, jfs/t1/239222/33/26660/137113/674efabfF41d58c7f/05bde6cf4d20554c.jpg.avif, jfs/t1/228269/14/28848/123542/674efabfF93cddbe3/767d32a1237fada0.jpg.avif, jfs/t1/153171/22/51218/139112/674efac2F21f18cd1/503a0d1a6bd61658.jpg.avif, jfs/t1/228000/20/29349/134977/674efabfFb896d5a0/603025ec2830175c.jpg.avif, jfs/t1/200380/11/49115/131542/674efac1F7b03aad1/4085834996b14fb7.jpg.avif, jfs/t1/225545/31/18816/158203/674efac4F999ebe93/564e4ddcc14e77fa.jpg.avif, jfs/t1/199262/26/49574/166180/674efac5Fda0fa2eb/66f0fe6e99264eed.jpg.avif, jfs/t1/244526/20/26878/158882/674efac5Faf5a7d63/04b37dc3d5b15c5b.jpg.avif, jfs/t1/244078/12/27321/166906/674efac7F22454844/04771c8e53924a4b.jpg.avif, jfs/t1/205555/30/51492/164457/674efac4F71d67647/7952fd888dc9f0fc.jpg.avif, jfs/t1/208534/22/50527/164800/674efac4Fdd70230c/18b703c8ec20b46c.jpg.avif",,,,,5.0
10110731381493,日普（RIPU）10公斤波轮,348.00,5000+,日普冰箱洗衣机旗舰店,https://item.jd.com/10110731381493.html,jfs/t1/247172/11/27269/154068/674d7226F5b407cd2/d2f1b947f4949308.jpg.avif,"jfs/t1/247172/11/27269/154068/674d7226F5b407cd2/d2f1b947f4949308.jpg.avif, jfs/t1/230868/32/24445/117749/66b08355F28c22d23/cb84905da3f4eb7a.jpg.avif, jfs/t1/90227/33/44009/180850/66c847e9F32544b21/68ac305551ab67e9.jpg.avif, jfs/t1/241653/33/12776/53688/6695ee21F36a7514f/8006d4891372d421.jpg.avif, jfs/t1/29098/16/21108/96014/6695ee21F3ac91864/0864218794b78dc5.jpg.avif",选择款式                                                ,"10公斤咖啡金【蓝光洗护+风干洁桶+强动力电机】, 10公斤宝石灰【蓝光洗护+风干洁桶+强动力电机】","jfs/t1/247172/11/27269/154068/674d7226F5b407cd2/d2f1b947f4949308.jpg.avif, jfs/t1/175943/16/53462/152424/674d2d6dFa94cba67/230b495827ff4bd2.jpg.avif",,,,,4.4
10121637794639,Hairex,538.00,1000+,久款电器专营店,https://item.jd.com/10121637794639.html,jfs/t1/231386/17/28497/174463/674d3fcaF1c344085/1d9cf5a5d36ccb0a.jpg.avif,"jfs/t1/231386/17/28497/174463/674d3fcaF1c344085/1d9cf5a5d36ccb0a.jpg.avif, jfs/t1/242515/4/15823/30638/66b47f94F9dcf9769/3f6819818eb3ff59.png.avif, jfs/t1/11873/36/23983/26253/66df9bccF860d3ea0/d327a95fec492b33.jpg.avif, jfs/t1/234644/39/25058/16999/66b47f9cF7c2df685/a3329723ab1ad112.png.avif, jfs/t1/243083/38/25404/173253/6743f6cdF4455efef/ad14838fe26085e8.jpg.avif",选择款式                                                ,"12公斤纳米/智能强力风干, 16公斤纳米/智能强力风干, 16公斤纳米/智能强力烘干, 18公斤纳米/智能强力风干, 18公斤纳米/智能强力烘干","jfs/t1/231386/17/28497/174463/674d3fcaF1c344085/1d9cf5a5d36ccb0a.jpg.avif, jfs/t1/231386/17/28497/174463/674d3fcaF1c344085/1d9cf5a5d36ccb0a.jpg.avif, jfs/t1/231386/17/28497/174463/674d3fcaF1c344085/1d9cf5a5d36ccb0a.jpg.avif, jfs/t1/231386/17/28497/174463/674d3fcaF1c344085/1d9cf5a5d36ccb0a.jpg.avif, jfs/t1/231386/17/28497/174463/674d3fcaF1c344085/1d9cf5a5d36ccb0a.jpg.avif",,,,,3.0
10114109602552,O&T,558.00,2000+,德源洗衣机专营店,https://item.jd.com/10114109602552.html,jfs/t1/238686/39/16186/136757/66de8a24Fae469be0/31ec33c6e53d6c74.png.avif,"jfs/t1/238686/39/16186/136757/66de8a24Fae469be0/31ec33c6e53d6c74.png.avif, jfs/t1/9510/30/26101/62783/66de8a23F85925b7d/90655f7cafe65743.png.avif, jfs/t1/163309/16/47841/124537/66de8a22Fd23d7c33/47ac7582a61e6515.png.avif, jfs/t1/249056/9/18529/75827/66de8a21Fffaa8671/cd37f77fd52a2070.png.avif, jfs/t1/27711/9/22608/100513/66de8a21F98196c51/65868b985c4d4c38.jpg.avif",选择款式                                                ,"10公斤 纳米/智能强力风干, 10公斤 纳米/智能强力烘干, 15公斤 纳米/智能强力风干, 15公斤 纳米/智能强力烘干, 18公斤 纳米/智能强力风干, 18公斤 纳米/智能强力烘干, 20公斤 纳米/智能强力风干, 20公斤 纳米/智能强力烘干, 15公斤 /智能强力烘干","jfs/t1/238686/39/16186/136757/66de8a24Fae469be0/31ec33c6e53d6c74.png.avif, jfs/t1/238686/39/16186/136757/66de8a24Fae469be0/31ec33c6e53d6c74.png.avif, jfs/t1/238686/39/16186/136757/66de8a24Fae469be0/31ec33c6e53d6c74.png.avif, jfs/t1/238686/39/16186/136757/66de8a24Fae469be0/31ec33c6e53d6c74.png.avif, jfs/t1/238686/39/16186/136757/66de8a24Fae469be0/31ec33c6e53d6c74.png.avif, jfs/t1/238686/39/16186/136757/66de8a24Fae469be0/31ec33c6e53d6c74.png.avif, jfs/t1/238686/39/16186/136757/66de8a24Fae469be0/31ec33c6e53d6c74.png.avif, jfs/t1/238686/39/16186/136757/66de8a24Fae469be0/31ec33c6e53d6c74.png.avif, jfs/t1/238686/39/16186/136757/66de8a24Fae469be0/31ec33c6e53d6c74.png.avif",,,,,4.6
10099162734572,志高8/10公斤全自动波轮,378.00,2万+,志高中冀专卖店,https://item.jd.com/10099162734572.html,jfs/t1/91778/23/52911/140507/672f092fF73c27b50/29407d8d3c36e5f0.jpg.avif,"jfs/t1/91778/23/52911/140507/672f092fF73c27b50/29407d8d3c36e5f0.jpg.avif, jfs/t1/183768/22/52723/107985/673d5c28F5b9e3249/45cc9020dd66a119.jpg.avif, jfs/t1/166221/6/46149/63396/66602414F5fc56c2b/18ac562ca65225ba.jpg.avif, jfs/t1/240815/21/6491/92647/65ffc323Fbb619e38/01a02c35c6ec80a3.jpg.avif, jfs/t1/196400/27/45975/89796/66725c3dF8964bd42/26ba567526a61fb2.jpg.avif",选择款式                                                ,"6.5KG宝石灰【优选推荐+风干洁桶+强电机】, 8KG宝石灰【主销特惠+智能风干+强力电机】, 10KG宝石灰【智能风干+蓝光洗护+强力电机】, 11KG宝石灰【智能风干+蓝光洗护+强力电机】, 12KG宝石灰【风干洁桶+蓝光洗护+洗脱一体】, 15KG咖啡金【升级加厚+蓝光洗护+强力电机】, 10KG宝石灰【升级加厚+蓝光洗护+强力电机】, 9KG宝石灰【智能风干+蓝光洗护+强劲电机】, 12KG宝石灰【升级加厚+蓝光洗护+强力电机】, 12KG咖啡金【强力烘干+智能风干+蓝光洗护】, 15KG咖啡金【智能风干+蓝光洗护+强力电机】, 15KG咖啡金【强力烘干+智能风干+蓝光洗护】","jfs/t1/177292/5/53309/124026/6736ff2bFe788cbd1/1f2ecf556803fca6.jpg.avif, jfs/t1/136234/27/48023/124430/67107ad3F45d32d7f/243a447ae225f6b9.jpg.avif, jfs/t1/201520/6/46631/141349/67107ad6F620543e7/9cc980eb04cb854b.jpg.avif, jfs/t1/91778/23/52911/140507/672f092fF73c27b50/29407d8d3c36e5f0.jpg.avif, jfs/t1/247714/32/26654/141410/674d5169F642baba3/bc522b272af4c0ed.jpg.avif, jfs/t1/157250/10/50674/135447/67415cfeFfb902861/6843c579312cbc2a.jpg.avif, jfs/t1/247649/23/21684/139698/67171abeF67f41774/bb49aeb7b50d2a7f.jpg.avif, jfs/t1/194724/25/51495/132837/673ea0d9F8c5522dd/dbf07093b94e881d.jpg.avif, jfs/t1/96244/22/51286/139703/67171ac0Fb58e7308/26bf050542214464.jpg.avif, jfs/t1/202581/2/46266/127053/671737d4Ff1fdd40a/944205c23576a34b.jpg.avif, jfs/t1/200069/5/48407/135322/67415d00F375776e8/01d38b80a1ed8ef3.jpg.avif, jfs/t1/240740/22/18628/126531/671737d6F66047c9f/cea7a6b8df9072bf.jpg.avif",,,,,4.8
100115318163,海信（Hisense）波轮,799.00,10万+,海信京东自营旗舰店,https://item.jd.com/100115318163.html,jfs/t1/197513/22/49544/165511/67486415Fc2ef489b/7035f1cebfe90aa3.jpg.avif,"jfs/t1/197513/22/49544/165511/67486415Fc2ef489b/7035f1cebfe90aa3.jpg.avif, jfs/t1/178444/28/52449/53722/673efa7bF76a43229/136733a3fda27b09.jpg.avif, jfs/t1/192312/39/48566/119459/671b5d7dFc9b7fb36/928260a552206d43.jpg.avif, jfs/t1/187342/24/47438/114214/671b5d7eF923c01c7/8270dc50f2276f35.jpg.avif, jfs/t1/137389/5/48930/190568/672b10dfF71312c07/eee4da4000863163.jpg.avif",选择款式                                                ,"12KG超大容量丨活水洗羽绒洗, 10.5KG升级款丨一键智洗一级能效, 10KG热销款丨大容量除菌除螨, 9KG升级款丨金属机身一级能效, 9KG行业爆款丨金属机身桶自洁, 8.5KG升级款丨金属机身一级能效, 8KG店铺销冠丨金属箱体除螨洗","jfs/t1/239203/37/25876/129150/67486412F2be6f823/f7db0fc6777f8526.jpg.avif, jfs/t1/197513/22/49544/165511/67486415Fc2ef489b/7035f1cebfe90aa3.jpg.avif, jfs/t1/245920/14/25069/140145/67486414Fd6328dac/25b4fe7f75329375.jpg.avif, jfs/t1/198704/18/51196/141968/67486405Ffd5a75e7/f378de665994b3ac.jpg.avif, jfs/t1/193522/38/52316/153582/67486416Fd70a4a4f/4fc86dd1ae0bc746.jpg.avif, jfs/t1/208954/9/49403/147731/67486418F36e4c7d9/22fd9903c26d2469.jpg.avif, jfs/t1/220638/19/50084/127184/67486417F3d2534a1/fbb729db89936d07.jpg.avif",,,,,5.0
54380653303,志高（CHIGO）10公斤,367.90,1万+,多方达大家电专营店,https://item.jd.com/54380653303.html,jfs/t1/184052/25/51759/558185/6724313eFedc1ed75/e5914ec7d0ee7627.png.avif,"jfs/t1/184052/25/51759/558185/6724313eFedc1ed75/e5914ec7d0ee7627.png.avif, jfs/t1/244893/10/7613/105301/6630a254F9b81b94a/657cc466623b2520.jpg.avif, jfs/t1/239913/11/7889/95280/6630a254F3b8e03d6/ad5d77da1d2f07c8.jpg.avif, jfs/t1/247284/22/7660/98411/6630a253Ff7efc95f/1d9d0966c7e804e9.jpg.avif, jfs/t1/150506/11/43989/74683/6630a253F32276e32/839a10aba0424b30.jpg.avif",选择款式                                                ,"10公斤咖啡金【蓝光洗护+风干洁桶+强电机】, 10公斤热烘干【蓝光洗护+洗烘一体+强电机】, 11公斤金色【蓝光洗护+风干洁桶+强电机】, 12公斤金色【蓝光洗护+风干洁桶+强电机】, 13公斤金色【蓝光洗护+风干洁桶+强电机】, 15公斤金色【蓝光洗护+风干洁桶+强电机】, 10公斤宝石灰【蓝光洗护+风干洁桶+强电机】, 10公斤玻璃盖板【蓝光洗护+风干洁桶+强电机】, 10公斤米白色【抗菌升级+风干洁桶+蓝光洗护】, 10公斤翠玉蓝【抗菌升级+风干洁桶+蓝光洗护】, 10公斤落樱粉【抗菌升级+风干洁桶+蓝光洗护】","jfs/t1/184052/25/51759/558185/6724313eFedc1ed75/e5914ec7d0ee7627.png.avif, jfs/t1/42375/33/24847/131907/66c9ac8aFbd20c4c1/c07e0e5fd9d1c882.png.avif, jfs/t1/151627/40/31642/87059/66cacf02F732459bc/699445d20c3c743c.png.avif, jfs/t1/93258/19/54950/558130/672432fbF871b6af6/fb53072b662f91a8.png.avif, jfs/t1/225276/34/28508/83962/67481977F1eb5e7bc/00200876695d4ccf.png.avif, jfs/t1/131284/1/49976/539204/67243362F8e387cb8/89e9c982785fe95e.png.avif, jfs/t1/6266/26/38794/443250/66c9ac89Fd2a10ec5/647f3f0319eb6796.png.avif, jfs/t1/144220/33/44554/79598/66c9ac8bF52a4c52e/c386ad6a73d7dc37.png.avif, jfs/t1/242180/4/15102/55139/66e69ce6F971bf60a/64fa3eb42cfd9d8e.png.avif, jfs/t1/227279/24/27296/52429/66e69ce7F39c5279c/f91be9ff12ee3aa3.png.avif, jfs/t1/88733/22/48255/53767/66e69ce8F49a2bd42/9a2cf516e8c8be52.png.avif",,,,,4.1
100063742092,海尔（Haier）波轮,1028.00,50万+,海尔京东自营旗舰店,https://item.jd.com/100063742092.html,jfs/t1/180893/20/53992/174130/6750101bF04a3aef9/810c27fb125c54f8.jpg.avif,"jfs/t1/180893/20/53992/174130/6750101bF04a3aef9/810c27fb125c54f8.jpg.avif, jfs/t1/177782/24/52876/79853/6747d8d8F0a8b8cca/bb2a0b3254295dc6.jpg.avif, jfs/t1/7288/3/26085/107973/66b9c2bcF67184ee4/385d66aa71fbe8d4.jpg.avif, jfs/t1/101411/36/51658/101704/67301dabFb273ac15/2cfc2506e5b7f4fc.jpg.avif, jfs/t1/247656/16/12282/99784/6674deecF5329c1e3/1867e6845cb5045b.jpg.avif",选择款式                                                ,"【金榜升级】8KG|创新超净洗, 【金榜】8KG|波轮销量TOP, 【除螨】10KG行业销量TOP, 【玻璃盖】首创敲敲洗33Mate2, 【变频】9KG|变频除螨-Mate1, 【变频销冠】10KG|健康洗护, 【变频】10KG|波轮销额TOP, 【防电墙】10KG丨变频旋瀑洗, 【变频玻璃盖】敲敲洗53Mate2, 【精华洗】电离除菌Mate5, 【大容量】12KG|强力洗除螨洗, 【大容量】12KG|变频漩瀑洗Mate1, 【大容量】12KG|变频漩瀑洗Mate3, 【手搓精华洗】12公斤629, 【双动力旗舰】变频彩屏Plus5, 【双动力进阶】销冠升级659, 【双动力旗舰】后置触控Plus6, 【双动力精华洗】顽渍洗Mate6, 【双动力精华洗】免清洗Mate6, 【双动力精华洗】全新外观mate7","jfs/t1/198776/7/48253/169998/6750100cF59da1093/df65fc11be739ade.jpg.avif, jfs/t1/178632/2/54856/161269/67500feeF378cba8e/1fe479e4bbefd4ce.jpg.avif, jfs/t1/217028/30/51538/163603/67500ff1F1aaebb1c/afc8bfdad604461a.jpg.avif, jfs/t1/245068/15/26219/155753/67500fffF85c0d324/b45a02b0410e7c2c.jpg.avif, jfs/t1/196702/18/53465/121124/6750103bF1e60ed6a/680ba39df9c07343.jpg.avif, jfs/t1/180893/20/53992/174130/6750101bF04a3aef9/810c27fb125c54f8.jpg.avif, jfs/t1/195656/2/54286/152755/67500fe2Fc5e52039/daa897cb4160e55f.jpg.avif, jfs/t1/205833/2/39486/158010/67500ff7F4f4924cc/30a696f4bd0a0132.jpg.avif, jfs/t1/173295/31/50653/168964/67501036F31d51aaa/b84d85e12b53968b.jpg.avif, jfs/t1/199297/36/50863/172245/67501013Fc784e9cc/58656d4784771b4d.jpg.avif, jfs/t1/190152/9/54500/163701/6750102eFeda364cf/61e959698498c225.jpg.avif, jfs/t1/177303/13/52171/154888/67500febF16328cea/a83a3aaf2b09d320.jpg.avif, jfs/t1/186628/36/54905/176056/6750103eF0702b699/ec0e68ca3eeabc97.jpg.avif, jfs/t1/134949/5/45051/161552/67500ff4F67526736/57f1ea160a68b0c0.jpg.avif, jfs/t1/245475/34/26896/148008/67500fe9F7e10c67b/9db6f82173797f33.jpg.avif, jfs/t1/195762/27/54419/166293/6750102cF3cb29be7/bbdab926f8620ea2.jpg.avif, jfs/t1/172914/30/53710/150007/67501005F77b8fb19/25afcd1ed87e2b06.jpg.avif, jfs/t1/199007/7/50952/167216/67501018F525ff816/1aa236cc1934bca7.jpg.avif, jfs/t1/196629/22/54598/171680/67501015Fa5b36579/00ee1fd6fac9abb1.jpg.avif, jfs/t1/190847/36/54510/161090/67501024F4b6a80b5/d3bc6a2307629245.jpg.avif",,,,,5.0
100070649669,创维10公斤滚筒,1099.00,20万+,创维冰箱洗衣机京东自营旗舰店,https://item.jd.com/100070649669.html,jfs/t1/249057/4/26432/144285/674b169bF04166d31/b06877a040e5f433.jpg.avif,"jfs/t1/249057/4/26432/144285/674b169bF04166d31/b06877a040e5f433.jpg.avif, jfs/t1/168287/16/52069/57300/673daca4F7d443d10/138af992de331832.jpg.avif, jfs/t1/88411/40/49299/122516/6719c432F53fcaa18/09951622ad0f3dfe.jpg.avif, jfs/t1/150792/34/24827/64027/664d93a6F009d0336/ab2b195f49ed6442.jpg.avif, jfs/t1/238124/25/1161/85796/6540972fF045ad067/03b8268e26e22c7f.jpg.avif",选择款式                                                ,"【✮店铺销冠】10KG超薄嵌入, 超级新品|DD直驱|洗烘一体, 【超大容量|超薄滚筒】12KG洗烘, 【租房优选】6KG超薄嵌入, 【超薄嵌入】智能喷淋洗","jfs/t1/249057/4/26432/144285/674b169bF04166d31/b06877a040e5f433.jpg.avif, jfs/t1/249796/30/26258/153511/674b1712F76305b80/bea43bc02c3720ac.jpg.avif, jfs/t1/197758/18/49206/170714/674b18d6F7d100e31/a65c5b4064175bcb.jpg.avif, jfs/t1/227236/13/31885/137636/674b164cF07fd785d/b0de870decb9d848.jpg.avif, jfs/t1/181568/12/53274/86976/674b17e9F99d87419/bd633a37d635808f.jpg.avif",,,,,5.0
100109518800,米家小米波轮,769.00,2万+,小米京东自营旗舰店,https://item.jd.com/100109518800.html,jfs/t1/217647/33/51167/104292/674b5d2bFe932e921/97f5b4d38b127563.jpg.avif,"jfs/t1/217647/33/51167/104292/674b5d2bFe932e921/97f5b4d38b127563.jpg.avif, jfs/t1/247269/29/24274/44996/673f1275F3930592a/4d95db3fe6237664.jpg.avif, jfs/t1/93842/8/44353/81320/664725fcF20ca51b4/13846ced02101cbc.jpg.avif, jfs/t1/220793/31/41741/75008/66472617Fcef8074c/ec3b1d9e71962474.jpg.avif, jfs/t1/248516/16/9208/48685/6647261eF5b2686e9/d0dfe4a467173292.jpg.avif",选择款式                                                ,"【店铺爆款】8kg超净洗波轮, 【重磅新品】10kg超净洗波轮","jfs/t1/217647/33/51167/104292/674b5d2bFe932e921/97f5b4d38b127563.jpg.avif, jfs/t1/224662/34/30643/106126/674884c6Fcea26ab4/a1f40d7c6f6b609f.jpg.avif",,,,,5.0
